name,date,leben,lengthleben,idn,iplace,ibio,url
"Krockow, Hans Kaspar von",1700 bis 1759,"Krockow: Hans Kaspar v. Krockow, preußischer Generalmajor, am 23. Aug. 1700 zu Peest im Kreise Schlawe geboren, studirte zu Halle, trat in das Kürassierregiment Nr. 6 des Prinzen Gustav von Anhalt und war bei Friedrichs des Großen Regierungsantritt Major in demselben. An den Feldzügen der beiden ersten schlesischen Kriege nennenswerthen Antheil zu nehmen, war ihm weder mit diesem Regimente, noch mit den Buddenbrock'schen Kürassieren, deren Commandeur er im October 1745 wurde, beschieden; dagegen suchte K. in der Pause zwischen beiden Campagnen durch freiwillige Theilnahme am Kampfe Oesterreichs gegen die Franzosen im J. 1743 sich praktische Erfahrung im Soldatenhandwerke zu erwerben. Erst der siebenjährige Krieg sollte ihm Gelegenheit geben, dieselbe zu verwerthen. Am 8. Decbr. 1750 zum Generalmajor der Reiterei, nach Buddenbrock's am 28. März 1757 erfolgten Tode zum Chef von dessen Kürassieren ernannt, rückte er mit der Schwerin'schen Armee in Böhmen ein, focht bei Prag und bei Kolin, that in der Schlacht an der Lohe sein Möglichstes, um den Sieg an die preußischen Standarten zu fesseln und zeichnete sich bei der bald darauf folgenden Revanche von Leuthen, obgleich in Folge an der Lohe erlittener Verletzungen so leidend, daß er sich auf das Pferd heben lassen mußte, auf dem linken Flügel unter Driesen fechtend, aus. Aber schon im folgenden Jahre empfing er bei Hochkirch, als er mit seiner Brigade der bedrängten Infanterie Beistand brachte, im Kampfe mit österreichischen Grenadieren eine schwere Wunde, welcher er am 25. Febr. 1759 zu Schweidnitz erlag.",1578,136522416,0,1,http://www.deutsche-biographie.de/sfz46110.html
"Weiß, Bartholomäus Ignaz",1730 bis 1815,"Weiß: Bartholomäus Ignaz Weiß, Maler und Radirer, wurde im J. 1730 zu München als Sohn des Malers Franz Josef W. geboren und von diesem in der Kunst unterrichtet, bis er im Stande war, sich durch das Studium der Galerien in München und Schleisheim weiter zu bilden. Wesentliche Dienste leistete W. auch die Beschäftigung mit Originalzeichnungen des Malers Andreas Wolf, die er in großer Anzahl gesammelt hatte. Selbst überaus fruchtbar, brachte er es im J. 1770 zum Mitglied der eben errichteten Münchener Akademie und später zu dem Range eines Hofminiaturmalers, als welcher er die Bildnisse des Kurfürsten Maximilian III. und seiner Gemahlin, der Kurfürsten Karl Theodor und Maximilian Josef IV., sowie diejenigen mehrerer anderer Mitglieder des bairischen Hofes malte. Außer Miniaturbildern lieferte er auch Oelgemälde und eine Menge von Radirungen im Rembrandtschen Geschmack zum Theil nach eigenen Compositionen, zum Theil nach Vorlagen berühmter Meister. Als eine seiner besseren Arbeiten wird eine Grablegung angeführt. Doch trug W. auch keine Bedenken, allerhand Schlüpfrigkeiten und Venusbilder für vornehme Besteller zu arbeiten. In der Galerie zu Schleisheim wird ein Bild von W. aufbewahrt, das einen alten in Pelz gekleideten Mann darstellt. Die Gemäldesammlung im Ferdinandeum zu Innsbruck besitzt eine Heilige Barbara von der Hand des Künstlers. Er starb zu München im J. 1815.",1392,123985277,0,1,http://www.deutsche-biographie.de/sfz84882.html
"Bagge, Ernst Baron von","erwähnt 1782, gestorben 1791","Bagge: Baron Karl Ernst Bagge, königl. preuß. Kammerherr und wunder licher Musikliebhaber, lebte um 1782 zu Paris und † daselbst 1791. Er spielte schlecht Bratsche und noch schlechter Violine, hielt sich aber für einen Virtuosen ersten Ranges und behauptete eine ganz neue Methode des Violinspiels erfunden zu haben, welche in einem Auf- und Niederglitschen mit demselben Finger auf den Seiten, ohne alle weitere Applicatur, bestanden haben soll. Die größten Künstler aller Nationen, und darunter Männer wie Viotti, mußten bei ihm Unterricht nehmen, um seine Manier kennen zu lernen, wofür er ihnen jede Lection, die sie von ihm empfingen, mit einem Louisd'or bezahlte. Er stand in großem Rufe, aber nicht blos eines Musiknarren, sondern auch eines feinen und echten Kenners und Beschützers wahrer Kunst. Denn merkwürdigerweise soll er in Allem, was nicht seine eigenen Leistungen betraf, Geschmack und Urtheil besessen haben; ganz Paris sprach noch lange von den vortrefflichen Concerten, die er in seinem Hause an der Place des victoires zu geben pflegte, und die größten Virtuosen, wie die Todi, die Mara, Viotti, Kreutzer, Duport, Punto, Besozzi und andere, ließen erst bei ihm sich hören, bevor sie öffentlich auftraten. Daneben besaß er große Herzensgüte und Liebenswürdigkeit und unterstützte Kunst und Künstler, wo und wie er vermochte, auf das Freigebigste, weshalb sein Tod, ungeachtet seiner Seltsamkeiten, viel und aufrichtig betrauert worden ist. Er hat auch componirt: ein Violinconcert, Paris um 1782, welches Kreutzer mit vielem Beifalle öffentlich gespielt hat; eine Symphonie in D, 8 Instr., in Hamburg bei Westphal noch 1795 zu haben. Vgl. auch Allg. Mus-.Ztg. III. 840; Marpurg, Metaphrastes 224. 277. ",1722,137309333,0,1,http://www.deutsche-biographie.de/sfz1875.html
"Buchta, Richard",1845 bis 1894,"Buchta: Richard Buchta, Maler und Afrikareisender. Er wurde geboren am 19. Januar 1845 zu Radlow in Galizien, bereiste als Photograph Deutschland, Frankreich und Kleinasien, kam Anfangs der 70er Jahre nach Aegypten und drang mit geringen Mitteln, aber mit Unterstützung der ägyptischen Verwaltung in den Sudan und in die Aequatorialprovinz vor, fand 1877 bei Emin Pascha in Ladó Aufnahme und wanderte als Maler und Photograph bis Uganda und Unyoro. Er brachte die gelungensten, auch wissenschaftlich werthvollsten Photographien mit, die bisher in Inner-Afrika gemacht worden waren. Eine Auswahl davon gab er 1861 als ""Die oberen Nilländer. Volkstypen und Landschaft, dargestellt in 160 Photographien, mit Einleitung von Dr. R. Hartmann"" heraus. Anfang der 80er Jahre ließ er sich in München nieder und malte im Auftrag des Königs Ludwig II. Miniaturen auf Elfenbein, mit Vorliebe Rococodamen. Nur mit seiner hochgradigen Kurzsichtigkeit war B. im Stande, diese ungemein fein ausgeführten Bildchen herzustellen. Mit dem Erlös seiner Kunst reiste er 1885 noch einmal nach Aegypten und besuchte das Fayum. Nach dem Tode des Königs wandte sich B. nach Wien, wo er als Gehülfe Junker's bei der Ausarbeitung des 1. Bandes der Junker'schen Reisen in Afrika thätig war und das Buch ""Der|Sudan unter ägyptischer Herrschaft. Rückblicke auf die letzten 60 Jahre"", ein Werk von Sachkenntniß und gesundem Urtheil, herausgab. 1884 hatte er eine Anzahl überarbeiteter Zeitschriftenaufsätze u. d. T.: ""Der Sudan und der Mahdi. Das Land, die Bewohner und der Aufstand"" drucken lassen. B. hatte einen feinen künstlerischen Blick, leistete als Maler und besonders als Photograph Hervorragendes, verstand auch gewandt und anziehend mit der Feder zu schildern. Seine Reiseberichte in den Geographischen Mittheilungen, im Ausland, in den Mittheilungen der Wiener Geographischen Gesellschaft erregten zu ihrer Zeit Aufsehen. Er starb am 29. Juli 1894 zu Wien. ",1937,116826959,0,1,http://www.deutsche-biographie.de/sfz6258.html
"Pinder, Moritz",1807 bis 1871,"Pinder: Moritz Eduard Pinder ist am 22. März 1807 zu Naumburg a/S. geboren. Nachdem er die Kreuzschule in Dresden und dann das Gymnasium seiner Vaterstadt besucht hatte, bezog er 1824 die Universität Berlin, um Philologie und Philosophie zu studiren. Zugleich beschäftigte er sich eifrig unter Schadows Leitung mit Zeichnen und Malen und erlernte auch die Kupferstecherkunst. In den Jahren 1826 und 1827 hielt er sich zur Fortsetzung seiner Studien in Wien, Paris und Bonn auf, und wurde dann, 1829 zum Dr. phil. promovirt, bei der königl. Bibliothek in Berlin angestellt. Daneben verwaltete er die Universitätsbibliothek und wurde Directorialassistent bei der Abtheilung der antiken Münzen im königl. Museum. 1851 wurde er Mitglied der Akademie der Wissenschaften und im J. 1858 Nachfolger Kuglers als Geheimer Regierungsrath und vortragender Rath im Ministerium für geistliche Angelegenheiten. Hier fand er ein reiches Feld erfolgreicher Wirksamkeit; die Errichtung des Rauch-Museums und der Nationalgalerie fallen, um nur Einiges zu nennen, in die Zeit seiner Amtsführung. Nachdem er 1868 zum Geh. Oberregierungsrath ernannt war, erlebte er noch den Beginn der Bauten der Nationalgalerie und des Siegesdenkmals auf dem Königsplatz zu Berlin und starb am 30. August 1871.",1273,116186402,0,1,http://www.deutsche-biographie.de/sfz64520.html
"Tellkampf, Adolph",1798 bis 1869,"Tellkampf: Johann Dietrich Adolf Tellkampf, Mathematiker, geboren am 23. Mai 1798 in Hannover, † am 9. März 1869 ebendaselbst. Kaum 16 Jahre alt, nahm T. als Osficier in der hannöverischen Armee an den Befreiungskriegen theil. Als er 1818 aus Frankreich heimkehrte, verließ er gleich vielen Anderen das Waffenhandwerk und begann in Göttingen unter Thibaut Mathematik zu studiren. Auf den Rath seines Lehrers versuchte er sich an der von der Universität gestellten Preisfrage und errang 1821 den Preis mit der Abhandlung ""Historia critica variarum opinionum quae circa corporum formam fluidam aut firmam hucusque in lucem prodiere"". Von 1822 bis 1824 war T. Privatdocent in Göttingen, dann Oberlehrer am Gymnasium zu Hamm in Westfalen, seit 1835 Director der höheren Bürgerschule in Hannover. Noch von Hamm aus veröffentlichte er 1835 in Crelle's Journal Bd. XIV einen lateinisch geschriebenen Aufsatz über gewisse geometrische Substitutionen, welche zur Auffindung einiger Integrale führen. Im 2. Bd. von Grunert's Archiv löstete er dann 1842 die Aufgabe, die Anzahl der möglichen Zerlegungen eines n-ecks in m-ecke mittels Diagonalenziehung zu finden. Auch ist T. der Verfasser geschätzter Lehrbücher. Seine ""Vorschule der Mathematik"" hat 1829 bis 1856 fünf Auflagen erlebt.",1275,117254843,0,1,http://www.deutsche-biographie.de/sfz26816.html
"Olmützer, Hans",erwähnt 1483 oder 1504 ,"Olmützer: Hans Olmützer oder Olomuczer, ein tüchtiger Bildschnitzer und Steinhauer, erwarb die Meisterschaft des ""Steynwergks"" unter Hans Linddörfer, dem Baumeister des Domstifts zu Passau, war nachher zu Görlitz ansäßig und arbeitete in Holzschnitzerei und feiner Steinhauerarbeit. 1488 schnitt er Christi Geburt und andere Bilder für den schönen Hochaltar der Minoritenkirche, die als Kunstwerke anerkannt sind. Das schönste Bild, die ""goldene Maria"" ist aber älter. Sie kaufte der Guardian Nicolaus v. Hirsberg 1383, ohne daß der Meister genannt ist, für 25¾ Mark. O. bekam einen rheinischen Gulden als Wochenlohn bei seiner Arbeit. Für die vom Wandschneider Hans Frenzel errichtete Annenkirche fertigte er die steinernen Bildsäulen der hl. Anna und ihrer Familie, ""Tafel"" genannt, meisterhaft, accordmäßig für 110 Gulden, doch unter Zusage des Bürgermeisters Valtyn Sneyder, daß er Mehrkosten auch ersetzt haben solle. Als dieses nicht geschah, verließ er, beleidigt. 1503 Görlitz mit Weib und Kindern, ""um sein Bestes zu suchen"", mit einem Empfehlungsbriefe des Rathes. Wo er geblieben, weiß man nicht.Script. rerum Lusat. N. F. 1. Bd., S. 305 u. 343. ",1157,132678756,0,1,http://www.deutsche-biographie.de/sfz73458.html
"Stürmer, Placidus",1716 bis 1794,"Stürmer: Placidus Stürmer, Benedictiner, geboren zu Kronungen am 13. Juli 1716, † zu Neustadt am Main am 24. April 1794. Nach Absolvirung des Gymnasiums trat er in das Benedictinerkloster Neustadt, legte am 19. Februar 1736 die Gelübde ab und wurde am 24. September 1740 zum Priester geweiht. In Neustadt hat er fast 60 Jahre verlebt, zuerst als Student, dann als Lector der Philosophie und Theologie und als Novizenmeister, von 1779 an als Prior. Er war ein talentvoller, fleißiger und selbständig denkender Gelehrter. Als Schriftsteller hat er nur einige specielle dogmatische Fragen behandelt. 1765 erschien zu Fulda ""Breves quaedam reflexiones ad responsa Billuarti in causa praedeterminationis. A. periodi Jul. 6479"". Vorher war schon gedruckt, aber nicht in den Buchhandel gekommen: ""Anonymi O. Seite B. Dogma scholasticorum de unitate in trinitate collatum cum celeberrimorum ecclesiae patrum eadem de re doctrina"" (Paris [?] 1760). Da die in dieser Schrift vorgetragene Ansicht als Tritheismus angegriffen wurde, u. a. von den Jesuiten, die die Theologia Wirceburgensis herausgaben, ließ St. von der Schrift zu Fulda (auf dem Titel-blatte steht Venedig) 1772 eine zweite Ausgabe erscheinen cum responsione ad oppositas dissertationes et objectiones quorundam theologiae professorum ex Seite J. et dissertatione apologetica, qua respondetur recentissimi adversarii [Bernardini Baur O. Cisterc.] objectis contra opusculum: Dogma etc. Die Schrift erschien auch unter dem Titel Sublime mysterium s. trinitatis in unitate collatum etc. zu Bamberg 1773. Außerdem erschien noch von St. 1783 ""Dissertatio de fato et statu theologiae in scholis catholicorum; subnectuntur aliae jam editae breves reflexiones (s. o.), auctore Theophilo Alethino O. Seite B.""",1755,13592720X,0,1,http://www.deutsche-biographie.de/sfz81883.html
Heinrich,"erwähnt 1086, gestorben 1096","Heinrich III. (I.), Graf von Luxemburg (1086—96), Nachfolger seines am 8. August 1086 verstorbenen Vaters Konrad, tritt als regierender Graf von Luxemburg zuerst auf in einer Urkunde des Kaisers Heinrich III., in welcher dieser die von dem Bischofe Diedrich von Verdun gestiftete Abtei St. Airy bestätigte. Auch besaß er die Advocatie der Abteien St. Willibrord und St. Maximin, welche in dem Hause der luxemburger Fürsten erblich war. Von einzelnen unter seiner Regierung eingetretenen Ereignissen ist fast nichts bekannt, als daß er mit dem Erzbischofe Egilbert von Trier einen Vertrag abgeschlossen, gemäß welchem er von diesem 600 mansi unter der Bedingung erhalten sollte, daß er ihn im Kampfe gegen jeden Feind, mit Ausnahme des deutschen Reichs, unterstützen werde. Wegen des frühen Todes des Grafen konnte der Vertrag nicht ganz erfüllt werden; H. erhielt nur 300 mansi, sein Bruder und Nachfolger Wilhelm die andere Hälfte. H., der schon 1096 starb, war lange Zeit von den vaterländischen Geschichtschreibern nicht einmal zu den regierenden Fürsten des luxemburger Landes gerechnet worden. Erst Ernst, der Verfasser der Geschichte von Limburg, und nach ihm ganz besonders Dr. Schötter haben mit unumstößlichen Beweisen dargethan, daß er zu den regierenden Grafen zu zählen ist. Einen zwar beredten, doch in seiner Beweisführung wenig logischen Verfechter fand die andere Meinung in Dr. Neyen.",1401,142356816,0,1,http://www.deutsche-biographie.de/sfz29098.html
"Crusius, Gottlob",1785 bis 1848,"Crusius: Gottlob Christian Crusius, Sohn eines Schullehrers und Cantors, geb. zu Liechtenstein im Königreich Sachsen 14. Juli 1785, † 12. Mai 1848. Vorgebildet auf dem Gymnasium zu Zwickau, wo er sich durch seine schönen Kenntnisse in Musik und Gesang bestens empfahl, bezog C. 1806 die Universität Wittenberg, um Theologie und Philologie zu studiren. Durch die Kriegsereignisse unterbrochen, vollendete er erst 1812 in Halle seine Universitätsstudien, von wo aus er zum dritten Lehrer und Cantor am Lyceum zu Osterode empfohlen wurde. Nach vierjähriger segensreicher Wirksamkeit daselbst folgte er 1816 einem Rufe als Cantor an das Lyceum zu Hannover, wo er auch aushülfsweise Unterricht in den alten Sprachen ertheilte. Zum Subrector 1826 ernannt, mußte er bald darauf wegen Kränklichkeit seine Stelle als Cantor niederlegen und wirkte fortan nur mehr als philologischer Lehrer bis zum Jahre 1843, wo er wegen eines Brustleidens mit dem Titel Rector seiner amtlichen Geschäfte entbunden wurde. Als Schriftsteller erwarb sich C. durch eine große Anzahl von Schulausgaben und Wörterbüchern über alte Schriftsteller einen in weiten Kreisen bekannten Namen; seine bedeutendste Leistung ist das in wiederholten Auflagen erschienene Wörterbuch über die Homerischen Gedichte.",1270,100765483,0,1,http://www.deutsche-biographie.de/sfz48946.html
"Benz, Severin",1834 bis 1898,"Benz: Severin Benz, Historienmaler, geboren am 14. März 1834 in Marbach (St. Gallen), † am 2. November 1898 zu München, betrieb zuerst die Kunstschlosserei und besuchte zur weiteren Ausbildung das Polytechnikum zu München, wo er zur Malerei überging und an der Akademie, erst bei Anschütz und seit 1857 bei Piloty, rasche Fortschritte machte. Vorzüglich der religiösen Malerei zugethan, lieferte er seit 1860 viele Kirchen- und Andachtsbilder, darunter eine ""Auferstehung"" 1863 (Stahlstich von H. Merz), wodurch er sich in Farbe und Technik als einen geschickten Schüler seines Meisters bewährte, welchem B. auch bei der Ausführung mehrerer Fresken, z. B. an der Westseite des Maximilianeums (Kaiser Ludwig d. Baier gründet das Stift zu Etal) assistirte. Als tüchtiger Componist bethätigte sich B. in der historischen Galerie des Nationalmuseums (Kurfürst Max Emanuel belagert 1691 Carmagnola in Piemont) und zeigte seinen Farben- und Formensinn auch mit idyllischen Scenen (Mutterglück) und kühneren Genrebildern (Banditen), insbesondere aber malte er in seiner Heimath viele Bildnisse, aber auch ganze Serien von anziehenden landschaftlichen Aquarellen, nicht allein aus der Schweiz, sondern vom Inn und der Salzach u. s. w. Ein schönes Motiv ""Tag an der Elm"" gestaltete B. 1884 zu einem großen sonnigen Oelbilde. Eine originelle Landschaft mit der ""Flucht nach Aegypten"" (1879 und 1883) staffirt, konnte als das ausgesprochene Programm aller Vorzüge dieses im fortwährenden Wechsel seiner Stoffe stets frisch und originell bleibenden Künstlers gelten, welcher schließlich noch an einem großen Genrestücke (Obstverkäuferin) arbeitete, dasselbe aber über zunehmender Kränklichkeit nicht mehr zur Vollendung brachte.",1716,118829726,0,1,http://www.deutsche-biographie.de/sfz3769.html
"Gläser, Franz",1798 bis 1869,"Gläser: Franz Gläser, geboren am 19. April 1798 zu Obergeorgenthal in Böhmen, kam seiner schönen Altstimme wegen frühzeitig in das zur katholischen Hofkirche gehörende Capellknabeninstitut nach Dresden, wo er guten Musikunterricht, im Gesange namentlich von Johannes Micksch, erhielt. Während der J. 1814 und 1815 besuchte er das Prager Conservatorium für Musik und schloß seine theoretischen Studien in Wien bei Heydenreich ab. Im J. 1817 wurde er stellvertretender, 1818 wirklicher Capellmeister am Josephstädter Theater in Wien, worauf er 1830 einem Rufe als Capellmeister an das Königstädtische Theater in Berlin folgte. Dort schrieb er nach einem Holtei'schen Text seine Hauptoper ""Des Adlers Horst"", welche mit Beifall über fast alle Bühnen Deutschlands ging und sich in einzelnen Aufführungen bis heute erhielt. Im J. 1842 wurde er zum königl. Capellmeister in Kopenhagen ernannt, wo er am 29. August 1869 starb. In seinen Stellungen in Wien und Berlin componirte er viele Gelegenheitsouverturen, sowie die Musiken zu Singspielen, Zauber- und Localpossen, Melodramen u. s. w. Außer der Oper ""Adlers Horst"" hat G. noch viele dramatische Musikwerke geschrieben, so den ""Bernsteinring"", ""Die Brautschau"", ""Aurora"", den ""Rattenfänger von Hameln"", ""Das Auge des Teufels"", ""Andrea"", ""Die Hochzeit am Comersee"" etc., Werke, die längst verschollen sind. Auch als Componist einzelner Instrumentalsachen, Arrangements und deutscher Lieder wurde er bekannt. Alle diese Werke zeigen den mit sämmtlichen Hilfsmitteln seiner Kunst vertrauten Musiker, dem auch Erfindung nicht abzusprechen ist; den meisten derselben aber fehlt geistige Tiefe und Originalität, den Opern auch wirklicher dramatischer Schwung. — Ein genaues Verzeichniß seiner Compositionen gibt Ledebur im Tonkünstlerlexikon Berlins (189).",1797,116649666,0,1,http://www.deutsche-biographie.de/sfz21086.html
"Götze, Johann Nikolaus Conrad",1791 bis 1861,"Götze*)Zu Band IX S. 512.: Johann Nikolaus Conrad Götze, geb. am 11. Febr. 1791 zu Weimar, erhielt schon frühzeitig den ersten Musikunterricht von seinem Vater, der als Violinist in der dortigen Hofcapelle angestellt war, und erregte bald Aufsehen als Violinspieler, wodurch er die Protection der Herzogin Amalie erlangte. 1805 ward er in der Hauscapelle des in Leipzig lebenden Grafen Augustowsky angestellt, trat aber schon 1806 in die Capelle zu Weimar ein und nahm 1808, unterstützt von der kunstsinnigen Erbgroßherzogin Maria Paulowna, Violinunterricht bei Spohr in Gotha. In der Composition bildete er sich aus unter Leitung Aug. Eberhard Müller's in Weimar. 1813 schickte ihn die Erbgroßherzogin nach Paris, wo er während 8 Monate das Conservatorium besuchte und das Glück hatte, Cherubini's und Kreutzer's Unterricht zu genießen. Nach weiteren Erfolgen als Componist und Violinvirtuos ward er 1826 zum großherzoglichen Musikdirector und Chorrepetitor am Hoftheater ernannt, trat nach langer erfolgreicher Thätigkeit 1848 in Pension und starb am 5. Decbr. 1861 in Weimar. Als Componist hat G. eine ziemlich große Thätigkeit entfaltet. Von seinen Opern wurden bekannt ""Der Zwiebelmarkt"" und ""Alexander in Persien (1814—19), sowie ""Das Orakel"" (1822) und ""Der Gallego"" (1834). Außerdem schrieb er die Musik zu verschiedenen Vaudevillen und Melodramen, einige Ouverturen, 4 Streichquartette (op. 2 u. 3), 3 leichte Trio's für 2 Violinen und Violoncell (Weimar, Voigt), Variationen für Violine, verschiedene Sachen für Pianoforte, Lieder etc. Alle diese Werke zeigen den formgewandten und kunstgebildeten Musiker, entbehren jedoch zu sehr selbständiger Erfindung und sind deshalb größtentheils vergessen. ",1708,120159139,0,1,http://www.deutsche-biographie.de/sfz21527.html
"Sommer, Friedrich","erwähnt 1593, gestorben 1620","Sommer: Friedrich Sommer, Moralist des beginnenden 17. Jahrhunderts, wurde 1593 lutherischer Pfarrer in Peterswalde bei Wehlau, 1594 in Seligenfeld bei Königsberg, 1602 in Cremitten bei Tapiau, 1603 in Schönfließ bei Rastenburg; von hier aus scheint er wieder nach Seligenfeld zurückgekehrt zu sein, wo er 1614 jedesfalls als Pfarrherr bezeugt ist und noch bis 1620 gewirkt haben könnte. Außer einer ""Synopsis historica lamentabilis excidii Hierosolymitani"" verfaßte S. in deutschen Reimpaaren einen ""Zorn- vnnd Genaden Spiegel In diesen letzten, elenden, betrübten und bösen Zeiten"" (Königsberg 1602), der den lutherischen Geistlichen nicht verleugnet. Der Zorn ist reicher und auch glücklicher vertreten, als die Gnade. Er ergießt sich nicht nur über den wüst geschmähten Papst zu Rom, der z. B. heißt ""ein Götzen-Knecht vnd Baalist, ein Bauchratz, der nur seufft und frist"" und über den etwas milder behandelten Klügling Calvinist, der sich untersteht, an Luther und Melanchthon Kritik zu üben, sondern auch die weltlichen Stände kommen wegen ihrer Völlerei und Hoffart sehr schlecht fort: auch bei ihm noch klingen die Töne der Teufellitteratur herein. Der grimmige Eiferer, dem nur die milden Stiftungen in Königsberg einiges Lob in Gestalt einer sehr öden, langweilig anerkennenden|Schilderung entlocken, glaubt der Welt Ende nah: Wälder, Korn, Nutzthiere nehmen ab, da die Menschen so sündhaft sind; er ist uneingeschränkt ein leidenschaftlicher laudator temporis acti. Stilistisch wurzelt er durchaus in dem derben Gepolter der Reformationssatire; im Versbau spüren wir doch auch bei diesem ostpreußischen Pfarrer, daß sich die von Opitz bald gesetzmäßig proclamirten metrischen Neuerungen stillschweigend vorbereiteten.",1728,124936482,0,1,http://www.deutsche-biographie.de/sfz80542.html
"Gersdorff, Karl Friedrich Wilhelm von",1764 bis 1829,"Gersdorff: Karl Friedrich Wilhelm v. Gersdorff, königlich sächsischer Generallieutenant, den 16. Febr. 1765 zu Glossen bei Weissenberg in der Lausitz geboren, studirte, nachdem er die Fürstenschule zu Grimma besucht, bis 1785 in Leipzig und Wittenberg und trat hierauf als Unterofficier in die sächsische Cavallerie. Die unteren Grade langsam durchlaufend, ward er 1807 Major und Generalstabschef des sächsischen Corps, welches mit der französischen Armee vereint in Polen kämpfte. In gleicher Eigenschaft wohnte er mit den sächsischen Truppen dem Feldzuge 1809 in Oesterreich bei, während dessen er bis zum Generalmajor avancirte. 1810 zum Chef des Generalstabes ernannt, hatte er wesentlichen Einfluß auf die in diesem Jahre stattfindende Reorganisation der Armee. Den 30. Juni 1812 bereits zum Generallieutenant befördert, war er nicht nur der militärische Berather seines Königs, sondern trat auch — namentlich während des Feldzugs 1813 in Sachsen — in nahe Beziehungen zu Napoleon. Nach der Schlacht von Leipzig von dem König Friedrich August getrennt, ward er erst nach dessen Rückkehr aus der Gefangenschaft zum General-Inspector der Armee-Reserve und den 16. Sept. 1822 endlich zum Commandanten des Cadettenhauses ernannt. Als solcher erwarb er sich die wesentlichsten Verdienste und machte das ihm anvertraute Institut zu einer Musteranstalt, deren Ruf sich weit über die Grenzen Sachsens verbreitete. Er starb am 15. Sept. 1829. ",1439,117543462,0,1,http://www.deutsche-biographie.de/sfz23099.html
