name,date,leben,lengthleben,idn,iplace,ibio,url
"Wendt, Hermann Friedrich",1838 bis 1875,"Wendt: Hermann Friedrich Wendt, Ohrenarzt, geboren am 8. März 1838 in Leipzig, studirte seit 1855 in Jena und Leipzig, erwarb am letztgenannten Orte die Doctorwürde mit der Inauguralabhandlung: ""De valvulae vaginalis dispositione naturali, morbosa, vitiosa"", einer gründlichen Anatomie und Pathologie des Hymen, worin übrigens auch der Nachweis geliefert wird, daß dies Wort als Masculinum zu gebrauchen richtiger ist. Nachdem W. zu seiner weiteren Vervollkommnung die geburtshilflichen Anstalten zu Prag und Wien besucht hatte, übernahm er 1862 eine Assistentenstelle an der Leipziger Gebärklinik, die er bis 1863 behielt. Von jetzt ab wandte er sich ausschließlich dem Specialstudium der Ohrenheilkunde zu, besuchte zu diesem Zwecke nochmals Wien und einige andere Universitäten, habilitirte sich dann 1866 für dieses Fach als Docent an der Leipziger Universität, übernahm die von Professor Winter daselbst|begründete Poliklinik für Ohrenkranke, wurde 1874 außerordentlicher Professor der Heilkunde, starb aber bereits am 21. October 1875 an den Folgen einer Gehirnaffection. W. war ein sehr gesuchter Ohrenarzt und hat sich um die wissenschaftliche Entwicklung dieses Fachs namentlich in pathologisch-anatomischer Beziehung sehr verdient gemacht. Erwähnenswerth sind besonders seine Forschungen über das Verhalten der Paukenhöhle beim Fötus und beim Neugeborenen und dessen forensische Bedeutung, sowie eine Reihe anderer theils im Archiv für Heilkunde, theils im Archiv für Ohrenheilkunde und in Schmidt's Jahrbüchern erschienener litterarischer Arbeiten. Für das große Ziemssen'sche Handbuch lieferte er den Abschnitt über die Krankheiten der Nasenrachenhöhle und des Rachens. Von W. rührt auch eine reiche Sammlung von makro- und mikroscopischen Präparaten her, die er für das pathologische Institut in Leipzig angefertigt hat.",1833,117572195,0,1,http://www.deutsche-biographie.de/sfz85032.html
"Enslin, Adolf","erwähnt 1854, gestorben 1882","Enslin: Adolf Enslin, Sohn von Theodor Christ. Friedr. E. (s. A. D. B. VI, 154), ebenbürtig seinem Vater als Buchhändler und gleich diesem verdient um die allgemeinen Interessen des deutschen Buchhandels. E. erlernte den Buchhandel bei Karl Baedeker in Koblenz, bei welchem er liebevolle Aufnahme und tüchtige buchhändlerische Ausbildung fand, wofür er seinem Lehrherrn allezeit treue Anhänglichkeit bewahrte. Nach einem kurzen Aufenthalte in Leipzig bei K. F. Köhler und nach einer dreimonatlichen Thätigkeit in Paris kehrte er nach Berlin zurück und etablirte sich am 15. April 1854 als selbständiger Buchhändler. Sein Geschäft umfaßte ursprünglich nur Sortiment, nach Ableben seines Vaters aber übernahm er auch dessen Verlag für seine Rechnung, führte denselben aber unter dem Namen des Begründers, seines Vaters, fort und betrieb beide Geschäftszweige hinfort mit gleich regem Eifer und Erfolg weiter. Später, nach Verkauf seines Sortiments an A. Bath (1876) widmete er sich ausschließlich dem Verlage. Besondere Verdienste hat sich E. um den Buchhandel gleich seinem Vater durch seine öffentliche Wirksamkeit als Mitglied der verschiedenen Aemter des Börsenvereins erworben. In den Jahren 1867/72 gehörte er diesem als Stellvertreter und 1872/82 bis zu seinem Tode, als erster Vorsteher an. Während seiner Amtsperiode wurde eine Durch- bezw. Neubearbeitung der Börsenvereinssatzungen vorgenommen, wie er überhaupt bestrebt war, die Vereinsverhältnisse zu klären und zu vereinfachen. Sein klarer und ruhiger Verstand, der groß und vornehm zu denken wußte und auf Andere leitend einzuwirken vermochte, ließ ihn hierbei stets das Richtige treffen. E. starb am 25. Juni 1882 plötzlich und unerwartet, ein herber Verlust für den Buchhandel, dem er seine edelsten Kräfte in nie ermüdender Weise gewidmet hatte.",1810,116506237,0,1,http://www.deutsche-biographie.de/sfz13406.html
Gerhard VI.,"erwähnt 1346, gestorben 1360","Gerhard, des ersten Markgrafen und Herzogs Wilhelm von Jülich ältester Sohn, nimmt eine gewisse Bedeutung in der niederrheinischen Regenten- und Territorialgeschichte durch den Umstand ein, daß er als Erbtheil seiner Gemahlin Margaretha, Tochter des Grafen Otto IV. von Ravensberg und Enkelin Adolfs V. von Berg, 1348 diese beiden Territorien an das Jülich'sche Haus brachte. Zwar|fand damals noch keine Vereinigung der beiden Herzogthümer Jülich-Berg statt, denn G. succedirte gar nicht im Stammlande seines Vaters, starb vielmehr schon vor diesem im J. 1360 (18. Mai). Aber sein Enkel Adolph beerbte wieder Reinold von Jülich-Geldern, den Enkel Wilhelms, und so war durch ihn doch der Grund gelegt zu der Concentrirung niederrheinischer Fürstenthümer in einer Hand, wie sie später in noch höherem Maße seitens Cleve stattfand. Außerdem aber vermehrte der junge tapfere Fürst, der Politik seines Hauses getreu, in den Kämpfen auf Seiten Ludwigs des Baiern und Karls von Luxemburg in Gemeinschaft mit seinem Vater gegen die (avignonistisch-) französisch gesinnten derzeitigen Erzbischöfe von Köln sein Territorium in kurzer Zeit um die Herrschaft Hardenberg, Stadt, Schloß und Zoll zu Kaiserswerth und den Hof Solingen.",1219,136648215,0,1,http://www.deutsche-biographie.de/sfz20552.html
"Werk, Franz Xaver",1769 bis 1856,"Werk: Franz Xaver Werk, katholischer Theologe, geboren am 26. Mai 1769 zu Steinbach bei Bühl, † am 26. December 1856. Er erhielt seine humanistische Ausbildung im Gymnasium des Prämonstratenserklosters Allerheiligen auf dem Schwarzwalde, studirte dann Philosophie und vier Jahre Theologie in Straßburg, wurde im Herbst 1791 Lehrer am Gymnasium in Baden und empfing am 2. Juli 1792 die Priesterweihe. 1795 bis 1800 wirkte er in der praktischen Seelsorge. Im November 1800 wurde er als Professor der Theologie nach Baden berufen und erhielt zugleich ein Kanonikat an dem dortigen Collegiatstift. Am 27. August 1804 wurde er ordentlicher Professor der Moral- und Pastoraltheologie an der katholisch-theologischen Facultät zu Heidelberg; bei deren Verschmelzung mit der Freiburger theologischen Facultät wurde er im Frühjahr 1807 als ordentlicher Professor der Pastoraltheologie nach Freiburg versetzt; 1847 wurde er pensionirt. W. war ein Mann von scharfem Verstand und vielseitigem Wissen, ließ aber, seinem Bildungsgange nach in der Aufklärungsperiode wurzelnd, die Richtung auf das Ideale vermissen; er war eine mehr praktisch angelegte, als zu wissenschaftlicher Arbeit berufene Natur; Umsicht und Geschäftsgewandtheit bewährte er in der Verwaltung der akademischen Nebenämter. — Schriften: ""Ueber theologische Spezialschulen"" (Archiv für die Pastoralconferenzen in den Landcapiteln des Bisthums Konstanz, 1818, Bd. I, Heft 6, S. 401—432; und separat Freiburg 1818); ""Stiftungs-Urkunden akademischer Stipendien und anderer milden Gaben an der Hoch-Schule zu Freyburg im Breisgau von 1477 bis 1842 chronologisch geordnet, auf Anordnung des akademischen Senats herausgegeben"" (Freiburg 1842).",1691,117295892,0,1,http://www.deutsche-biographie.de/sfz85100.html
"Kiesling, Johann Gotthard",gestorben 1752,"Kiesling: Johann Gotth. Kiesling (auch Kisling), Advokat und sächsischer Notarms, der Mineralogie Beflissener und eifriger Mineralog, vielfach verwechselt mit Johann Kiesling, Dr. der Theologie und Prof. der Philosophie in Erfurt (geb. 1663, † 1715), welcher zwar auch eine kleine mineralogische Abhandlung ""Disputationes de admirandis naturae in regno minerali conspicuis"", 1698, schrieb, aber sonst für die mineralogische Wissenschaft nicht von Bedeutung ist, wol auch mit dem Jesuiten Johannes Kisling, Dr. und Professor der Philosophie in Prag (geb. 1713, † 1748), von dem gleichfalls eine Publication mineralogischen Inhalts herrührt: ""Compendium physicae experimentalis de corporibus mixtis mineralibus"", 1748. Der Erstgenannte, über dessen Verhältnisse wenig bekannt ist, lebte um die Hälfte des 18. Jahrhunderts und schrieb verschiedene bemerkenswerthe Schriften über mineralogische und montanistische Gegenstände: ""Relatio practica de arte probatoria mineralium et metallorum"", 1741, von welcher 1752 eine 2. Aufl. erschien; dann: ""De corporibus mineralibus Bohemiae"", 1747, ""Nachrichten von dem Bergbau und Schmelzwesen in der Grafschaft Mannsfeld, wie nämlich ersterer geführt, letzteres traktirt wird, nebst einer Erzählung von Muthmaßungen auf Bergwerke, der Wünschelruthe, Kuxhändler etc."", 1747. ""Magazin oder Vorrathskammer zu Wirthschaften für Mannspersonen und Frauenzimmer"", 1752.",1399,100975593,0,1,http://www.deutsche-biographie.de/sfz40901.html
"Steinhuser, Antonius","erwähnt 1468, gestorben nach 1482   ","Steinhuser: Antonius (Toni) Steinhuser, Dichter des 15. Jahrhunderts, war gebürtig aus Wyl (zwischen Winterthur und St. Gallen), lebte 1468 in Appenzell, wo er als lobsingender Spielmann eine Rolle gespielt zu haben scheint, wie sie wol auch den Dichternamen Frauenlob, Frauenehr, Frauenpreis, Frauenscherz zu Grunde liegt. Im Appenzeller Contingent macht er die Expedition gegen Waldshut mit, der sein einziges erhaltenes Lied gilt. 1470 und 1482 finden wir ihn in Luzern, beidemal in Rechtshändel verwickelt, von denen ihm der spätere Gefängniß und Landesverweisung zuzieht; doch ist er bald begnadigt worden. Sein Waldshuter Lied, in einer kurzen zweitheiligen Weise verfaßt, athmet den nur allzu berechtigten streitbaren Uebermuth der Eidgenossen, die nacheinander im Mühlhäuser Krieg und in der erfolgreichen Belagerung von Waldshut den österreichischen Rittern ihre Ueberlegenheit bewiesen, obendrein an Kriegsentschädigung und durch Raubzüge reichen Gewinn davon getragen hatten. Steinhuser's dramatisch belebter Bericht, der die stolzen Ritter prahlend vorführt und den verpfändeten Schwarzwald apostrophirt, ist von knapper Thatsächlichkeit, die aber durch allerlei Landsknechtswitze gewürzt wird; metrisch zeigt er die naive Sorglosigkeit des Volksliedes.",1265,104160543,0,1,http://www.deutsche-biographie.de/sfz81220.html
"Ditterich, Franz Georg von",1745 bis 1811,"Ditterich: Franz Georg v. Ditterich, geb. 1745, hatte seine Studien in Bamberg und Straßburg gemacht, wurde in letzter Stadt Professor des geistlichen Staatsrechts an der 1777 vom Bischof Cardinal Rohan gegründeten Schule, fungirte zugleich als fürstlich Salm-Salm'scher Hofrath, Speier'scher Geheimerath und Advocat bei dem königlichen Rath im Elsaß, flüchtete 1790 nach München, wo er 1791 zum kurfürstlichen Oberlandesgerichtsrath und Büchercensurrath ernannt, 1792 vom Kurfürsten Karl Theodor während des Reichsvicariats nobilitirt, bei der Wendung der kirchlichen Politik unter Maximilian Joseph pensionirt wurde und im October 1811 starb. Als Censurrath wirkte er im Geiste möglichster Knechtung der Litteratur. Seine schriftstellerischen Arbeiten tragen einerseits den streng ultramontanen Charakter, andererseits den von Advocatenschriften. Seine canonistischen Schriften sind: ""Diss. inaug. de successione primogeniti clerici in feuda maiora imperii germanici"", Argent. 1771. 4 (auch in Schmid, Thesaurus VI. p. 1 ss.); ""Positiones ex iure publico ecclesiastico"". 1780. 4. 2 Thle.; ""De Primatu Rom. Pontificis Diss. III. Justino Febronio abbreviato et emendato oppositae"", 1780. 4.; ""Noch einmal: Was ist der Papst? entgegengesetzt der biblischen Frage: was ist der Papst?"" 1782; ""Genuina dissert. can. de potestate eccles. in statuendis impedimentis matrim."", 1785. 4. — Publicistische Schriften: ""Tractatio iurid. de legitimis natalibus inter illustres praesumendis"", 1776; ""Primae lineae iuris publici ecclesiastici"", 1778; ""De regum Francorum capitularibus"", 1787. Sämmtlich in Straßburg gedruckt. Dazu verschiedene Proceßschriften, Recensionen etc.",1662,100106935,0,1,http://www.deutsche-biographie.de/sfz11419.html
"Neuhofer, Gerhard Adam",1773 bis 1816,"Neuhofer: Gerhard Adam Neuhofer wurde am 16. Januar 1773 zu Augsburg geboren, besuchte daselbst seit 1778 die Gymnasialclassen bei St. Anna und wurde 1785 unter die Alumnen des Collegiums bei St. Anna aufgenommen. Im Herbst 1791 bezog er die Universität Altdorf, wo er bis Ende 1795 Humaniora, Philosophie, Geschichte und Theologie studirte, und kehrte dann in seine Vaterstadt zurück. Nachdem er hier im folgenden Jahre sein theologisches Examen bestanden, wurde er 1797 Katechet im Zucht- und Arbeitshanse daselbst, erhielt zu Anfang des Jahres 1799 die Stelle eines Pestilentiarius, die ihm in den Jahren 1799 und 1800 in den Militärhospitälern viele Arbeit, viele Erfahrungen, aber auch wegen der ansteckenden Spitalkrankheiten manchmal Lebensgefahr brachte. Im J. 1803 wurde er Adjunct im Hospital, 1805 Diakonus an der Barfüßerkirche, 1806 Diakon an der St. Jakobskirche, und 1807 bei der provisorischen Einrichtung der höheren Lehranstalten in Augsburg zum Gymnasialprofessor und bei der definitiven Organisation der Studienanstalt zum Progymnasiallehrer ernannt. Da ihm aber das Lehramt bei seiner Kränklichkeit und bei seinen geistlichen Functionen zu beschwerlich ward, so erhielt er Ende 1809 die erbetene Entlassung aus demselben. Seit Juli 1813 Diakonus bei St. Anna, starb er am 12. December 1816. Ein großer Freund der Geschichte gab er 1798—1800 ein Taschenbuch für Geschichte unter dem Titel: ""Teutschfranzösischer Kalender"" heraus, dessen Fortsetzungen von 1801—1803 als ""Taschenbuch für Geschichte und Unterhaltungen"", und von 1804—1809 als ""Klio und Euterpe"" erschienen. Auch zahlreiche Dichtungen legte er in mehreren Sammlungen (""Gedichte""; II, 1804.—""Christliche Gesänge und Lieder"", 1808) nieder.",1720,104089016,0,1,http://www.deutsche-biographie.de/sfz71437.html
"Meibom, Johann Heinrich",1590 bis 1655,"Meibom: Johann Heinrich Meibom, Mediciner, Sohn des älteren Heinrich (s. oben), geb. 1590 zu Helmstedt, † 1655 zu Lübeck. Nach größeren Studienreisen wurde er 1619 zu Basel Doctor der Medicin, 1620 Professor der Semiotik zu Helmstedt. Der dreißigjährige Krieg veranlaßte ihn, 1625 Helmstedt mit Urlaub zu verlassen und von Lübeck aus, wo er sich als Arzt niederließ, 1629 seine Professur niederzulegen. Neben der Praxis beschäftigten ihn humanistische Studien und namentlich die Geschichte der Medicin. Ein vierbändiges Werk, welches dieselbe bis zum 15. Jahrhundert behandelte, 'war bei seinem Tode der Vollendung nahe; den Abschluß verhinderten die Schwierigkeiten, welche ihm die arabische Medicin verursachte. Die im Druck erschienenen theils medicinischen, theils historisch-philologischen Schriften (Mäcenas, Eid des Hippokrates) sind am vollständigsten bei Moller, Cimbria lit. II, 543 verzeichnet. Seine Correspondenz, namentlich mit seinem vertrauten Freunde G. Calixt, befindet sich in den Bibliotheken zu Wolfenbüttel und Hannover, sein medicinischer Nachlaß in der Bibliothek zu Göttingen.",1101,104273704,0,1,http://www.deutsche-biographie.de/sfz59856.html
"Kasthofer, Gottlieb Rudolf",1767 bis 1823,"Kasthofer: Gottlieb Rudolf Kasthofer, Kanzler des Kantons Aargau (1768 bis 1823). Er wurde den 27. Febr. 1768 in Bern geboren und erhielt, nachdem er die gewöhnliche praktische Bildung empfangen, eine kleine Staatsbeamtung in seiner Vaterstadt. Die politischen Stürme der Revolution machten erst seinen Werth offenbar. K. gehörte zu den Männern, welche eine Veränderung der Staatseinrichtungen herbeizuführen, aber jede Anwendung von gewaltthätigen Mitteln zu vermeiden wünschten. Als die Umwälzung vor sich gegangen, trachtete er der Parteiwuth nach beiden Seiten Einhalt zu thun. Unter der helvetischen Einheitsverfassung wurde er Vorsteher der Kanzlei im Ministerium des Innern, dann Regierungsstatthalter des Kantons Bern vom November 1802 bis zur Einführung der Vermittlungsakte, 1804, welche der Schweiz ihre frühere föderale Gestalt wieder gab. Er wandte sich jetzt nach Aarau, wo seine Familie das Bürgerrecht besaß, wurde Kanzler des neugeschaffenen Kantons Aargau und war nach den verschiedensten Seiten thätig, um das öffentliche Leben des neuen Staates zu heben und zu pflegen, als Mitglied des großen Rathes, des Bezirksschulrathes und anderer Behörden, namentlich aber von 1820 bis zu seinem Tode, als Präsident der ""Gesellschaft für vaterländische Cultur"", deren tiefgreifendem Wirken der Aargau vieles verdankt. Er starb in den ersten Tagen des Jahres 1823. Sein Charakter hatte ihm allgemeine und ungetheilte Achtung verschafft.",1445,137717792,0,1,http://www.deutsche-biographie.de/sfz40097.html
"Steuber, Johannes",1590 bis 1643,"Steuber: Johannes Steuber, geboren am 16. Januar 1590 zu Schwickardshausen (bei Nidda in Oberhessen), als Sohn des Pfarrers zu Lißberg und Schwickardshausen gleichen Namens. Seine Erziehung erhielt er auf den Pädagogieen zu Marburg und Gießen. Seit 1606 besuchte er die Universität Gießen, später Heidelberg. 1614 erhielt er zu Gießen die Professur für Physik und kurz darauf die der griechischen Sprache, 1620 die der Theologie und des Hebräischen. 1627 siedelte er mit der Universität nach Marburg über und wurde Prediger an der Elisabethkirche und Universitätsbibliothekar; letzteres Amt vertauschte er 1635 mit dem Ephorat der Stipendiaten. Am 5. Februar 1643 starb er infolge eines Schlaganfalls. Er war ein bedeutender Kenner der griechischen und hebräischen Sprache, welche er beide mündlich wie schriftlich beherrschte und in ihnen Disputationen abhielt; einige seiner Disputationen sind griechisch abgefaßt. 1626 gab er eine griechische Grammatik heraus. Seine zahlreichen Schriften (darunter viele Disputationen) sind philosophischen und theologischen Inhalts. 1641 verfaßte er ""S. Elisabeth, ihr Leben, Handel und Wandel"".Sein Urenkel Johann Engelhard St. (geboren 1693 in Marburg, † 1747 in Rinteln), wie auch dessen Sohn Christian Georg St. (1731 bis 1789) waren ebenfalls namhafte Hebraisten.",1306,124615023,0,1,http://www.deutsche-biographie.de/sfz74898.html
"Köhler, Benjamin Friedrich",1730 bis 1796,"Köhler: Benjamin Friedrich Köhler, bekannt als geistlicher Liederdichter, wurde am 22. Juni 1730 zu Döbeln im Königreich Sachsen geboren, wo sein Vater Diaconus war. Als letzterer im J. 1731 starb, begab sich die Wittwe mit dem Knaben zu ihrem Vater, dem Freiherrn v. Buda auf Börtewitz, zurück, wo K. nunmehr unter der Leitung des Großvaters erzogen wurde. Von 1744 bis 1749 besuchte er die Schule in Freiberg, bezog darauf die Universität Leipzig und schloß sich hier besonders an Gellert an. Nach vollendeten Studien übernahm er die Führung eines jungen Freiherrn v. Gersdorff und begleitete diesen längere Zeit auf Reisen. Im J. 1767 wurde er auf Empfehlung Gellert's Hofmeister des damals 16jährigen Prinzen Albrecht von Anhalt-Dessau, jüngsten Bruders des rühmlichst bekannten, kunstsinnigen Fürsten Leopold Friedrich Franz von Anhalt-Dessau und erhielt zugleich den Titel eines Hofraths. Im J. 1768 legte er jedoch diese Stelle schon wieder nieder und trat unter Beibehaltung seines bisherigen Titels in die fürstliche Landesregierung zu Dessau ein, indem er in derselben das Secretariat und die Leitung des Justiz-, Consistorial- und Geheim-Archivs übernahm. Er starb als Regierungsrath am 4. Mai 1796 zu Dessau.— Im J. 1763 veröffentlichte er in Leipzig ""Geistliche, moralische und scherzhafte Oden und Lieder, in vier Büchern, nebst einigen anderen Gedichten."" Von seinen geistlichen Liedern gingen mehrere in verschiedene Gesangbücher (das Zollikofer'sche, das Neue Delitzscher, das Neue Dresdener, das Anhalt-Dessauische Gesangbuch etc.) über.",1555,13611072X,0,1,http://www.deutsche-biographie.de/sfz43652.html
"Schubauer, Friedrich Leopold",1795 bis 1852,"Schubauer: Friedrich Leopold Schubauer, Schlachtenmaler, geboren zu Dresden 1795, † zu Kahnsdorf bei Borna am 28. April 1852, war ursprünglich Officier in sächsischen Diensten und brachte es als solcher bis zum Oberstlieutenant. Später verlegte er sich auf die Malerei, wobei er hauptsächlich|Kampfscenen aus dem ersten Viertel des 19. Jahrhunderts schilderte. Ein Theil seiner Gemälde ging in den Besitz des Königs von Sachsen über und ist in den königlichen Schlössern zu suchen. Andere wurden vorzugsweise von sächsischen Aristokraten erworben. Unter andern kaufte der König von Sachsen eine Schilderung der Schlacht bei Podolna, die Sch. im J. 1837 gemalt hatte. In dem Schlosse Reibersdorf bei Zittau, das dem Kammerherrn von Einsiedel gehört, hängt eine Scene aus dem Gefecht bei Düppel vom 13. April 1849, in der das Eingreifen der königlich sächsischen Artillerie dargestellt ist. In öffentlichen Sammlungen ist Sch. nur einmal vertreten, und zwar im städtischen Museum zu Leipzig, wo man ""die Erstürmung der großen Redoute in der Schlacht an der Moskwa durch sächsische Garde du Corps 1812"" sehen kann. Auch als Bildnißmaler versuchte sich Sch. Man kennt ein Porträt des Prinzen Albert in der Uniform des I. Infanterie-Regiments ""Prinz Albert"" vom Jahre 1847, das im königlichen Schlosse zu Dresden aufbewahrt wird. Eine Anzahl Skizzen von der Hand des Künstlers besitzt die Armee-Sammlung in Dresden.",1410,138218846,0,1,http://www.deutsche-biographie.de/sfz79276.html
"Benigni, Josef",1782 bis 1849,"Benigni: Joseph Benigni, von Mildenberg, siebenbürgisch-deutscher Patriot und Schriftsteller, geb. zu Wien 20. Januar 1782, † 11. März 1849. Als Jüngling gegen die Franzosen kämpfend, trat er später in die Militärverwaltung ein und lebte, seit er als Feldkriegscommissär in den Ruhestand versetzt war, in Hermannstadt, wo er sich seßhaft gemacht hatte, zur Hebung deutschen Sinnes und Strebens in jeder Weise kräftig, ja hervorragend mitwirkend. Langjähriger Redacteur des ""Siebenbürger Boten"" war er ein flinker, stets schlagfertiger Vertheidiger des Deutschthums in Siebenbürgen, namentlich in den Wirren des J. 1848. Als aber am 11. März 1849 die ungarischen Truppen die Stadt einnahmen, wurde der greise Patriot von einem Haufen Uebelthäter überfallen und grausam ermordet, als Märtyrer für die Sache, welche er mit Wort und Schrift vertreten hatte. Vielseitig gebildet, mit umfassenden Sprachkenntnissen ausgerüstet, arbeitete er viel und leicht, mitunter flüchtig. Doch sind viele seiner Arbeiten, welchen er mehr Zeit widmete, mit Recht geschätzt. Von den im Druck erschienenen zahlreichen Publicationen ist sein ""Handbuch der Statistik und Geographie von Siebenbürgen"" bekannt. Sein größtes und bestes Werk — gewissermaßen ein Unicum — ist die leider nur im Manuscript befindliche ""Geschichte der siebenbürgischen Militärgrenze, mit Acren belegt"". 6 Bde. Folio. 1811. Seine Werke sind verzeichnet in Joseph Trausch, Schriftstellerlexikon der siebenbürgischen Deutschen. I. Bd., S. 96—102. ",1497,100034438,0,1,http://www.deutsche-biographie.de/sfz3730.html
"Frank, Othmar",1770 bis 1840,"Frank: Othmar Frank, Orientalist, geb. 8. Mai 1770 in Bamberg, trat nach ebendort vollendeter Schulbildung in das Benedictinerkloster zu Banz, erhielt 1794 die Priesterweihe und wirkte als Lehrer der Philosophie und Mathematik in seinem Kloster, dann am Lyceum zu Bamberg. Nach der Säcularisirung des Klosters wandte er sich den orientalischen Studien, die er schon früher begonnen, eifriger zu, ward 1813 auf Staatskosten zum Studium des Sanskrit nach Paris, 1814 nach London geschickt, kehrte 1817 nach München zurück und erhielt 1821 die Professur für indische und persische Sprache in Würzburg. Bei der Verlegung der Universität Landshut nach München ward er 1826 als Professor des Sanskrit dahin versetzt und zugleich ordentliches Mitglied der königl. bairischen Akademie der Wissenschaften; 1840 im Auftrage des Königs zum Ankauf einer Sammlung indischer Antiquitäten nach Wien geschickt, starb er dort am 16. September. Frank's Thätigkeit und Schriften sind fast ohne Wirkung auf die Entwicklung der Sanskritstudien und der Sprachwissenschaft geblieben wegen seiner Neigung zum Mysticismus und seiner schwerfälligen, unklaren Darstellungsweise. Diese Fehler zeigen sich von seinen ersten Schriften an (""Das Licht vom Orient"". 1. Th. 1808; ""De Persidis lingua et genio"", 1809) und beeinträchtigten auch die Brauchbarkeit seiner ""Chrestomathia Sanskrita"" I. II. 1820—21, sowie die seiner ""Grammatica Sanskrita"", 1823, letztere verschwand gänzlich vor dem 1827 vollendeten ""Lehrgebäude der Sanskrita-Sprache"" Bopp's. Kleinere Arbeiten über indische Alterthumskunde und Mythologie stehen in Th. 1—3 der Abhandlungen der philos.-philol. Cl. der königl. baier. Akademie; Frank's letztes größeres Werk ist ""Die Philosophie der Hindu. Vaedanta Sara und Sadananda, sanskrit und deutsch zum ersten Mal übersetzt, mit ... Auszügen aus den Scholien des Rama-Krishna-Tirtha"", 1835.",1875,116704128,0,1,http://www.deutsche-biographie.de/sfz16860.html
