name,date,leben,lengthleben,idn,iplace,ibio,url
"Rippel, Anton Gregor",1681 bis 1729,"Rippel: Anton Gregor Rippel, kathol. Schriftsteller, geb. zu Schlettstadt im Elsaß am 10. Juni 1681, studirte bei den Jesuiten daselbst, trat 1700 in ihren Orden, wurde 1715 daraus entlassen, erhielt am 21. December 1719 die Pfarre Fessenheim, womit damals auch die jetzige Pfarre Nordheim vereinigt war, wurde zugleich Präbendar am Allerheiligenstifte zu Straßburg und starb zu Fessenheim als Pfarrer daselbst am 6. Jänner 1729. Er schrieb: ""Lutheranus inexcusabilis"". Straßb. 1721. Sein Hauptwerk ist: ""Alterthumb, Ursprung und Bedeutung aller Ceremonien, Gebräuchen und Gewohnheiten der Heil. Catholischen Kirchen"". Straßburg 1723. R. dedicirte diese Schrift dem Magistrate seiner Vaterstadt Schlettstadt. Das ganze Buch, welches die Form eines Gespräches zwischen einem Neubekehrten und einem Doctor der Theologie hat, ist in 3 Theile abgetheilt, von denen der erste die Ceremonien behandelt, welche auf die Feste des Kirchenjahres fallen, der zweite die Ceremonien der Sacramente, der dritte jene Ceremonien, die da und dort in der Kirche im Gebrauche sind, bespricht. Das Werk erlebte schon im vorigen Jahrhundert viele Auflagen; 1772 erschien die 8. zu Augsburg und Freiburg i. Breisgau. Himioben arbeitete dasselbe um und gab es unter dem Titel heraus: Die Schönheit der kath. Kirche in ihren äußeren Gebräuchen u. s. w. Mainz 1841, 21. Auflage Mainz 1885. ""Mysteria Jesu Christi"" in 4° und ""Mysteria B. M. Virginis"", beide nach dem Tode Nippel's herausgegeben von Michael Wohlrab zu Augsburg und Constanz 1731.",1519,100976433,0,1,http://www.deutsche-biographie.de/sfz76636.html
"Philicinus, Petrus",1515 bis 1568,"Philicinus: Petrus Philicinus, lat. Dramatiker. Geb. 1515 zu Arras, seit 1544 Lehrer zu Binche im Hennegau, wurde daselbst Dechant und starb 1568. Die Comoedia tragica von der ""Magdalena evangelica"", die er bereits früher in jambischen Dimetern verfaßt hatte und die nachher von Levin Brecht in die Form einer Komödie gebracht war, erschien 1544 zu Antwerpen, nachdem er durch die Pest aus Binche Vertrieben, zu Ham in der Picardie Muße gefunden hatte, sie umzuarbeiten. In fünf Acten schildert er im Charakter des Passionals das Erscheinen der Maria Magdalena mit Maria Salome und Maria Jacobi am Grabe Jesu, ihre Trauer um den Verlust des Herrn, ihre Freude über das Wiedersehen des geliebten Meisters, der ihr in der Gestalt eines Gärtners begegnet. Warme Empfindung, tiefinniges Gefühl zeichnen den Charakter der Frauen, besonders der Magdalena, aus. Ihre Klagen sind so eindringend, daß sogar die Wächter des Grabes davon ergriffen und in Mitleidenschaft gezogen werden. Dem gegenüber erscheint die Kälte und die Hartherzigkeit, Furcht und Kleinmüthigkeit der Hohenpriester Kaiphas und Hanna sehr wirkungsvoll. Auch Petrus und Johannes sind mit liebevoller Theilnahme für das Schicksal ihres Herrn erfüllt. Christus selbst erscheint in der Glorie des Auferstandenen, mild und sanft, tröstend und stärkend. Am Schluß fügt Levin Brecht ein Jubellied der Magdalena, nachdem den Weinenden Christus am Grabe erschienen ist. P. schrieb ferner einen ""Dialogus de immolatione Isaaci"" (Antw. 1544), sowie eine Tragödie von der Esther (Antw. 1564) und gab seines Freundes, des Abtes Ludw. Blosius (Abbas Laubiensis et Broniensis) Werke heraus. Die Quellen nennen ihn einen Mann von großer Heiligkeit des Lebens, gastlichem Sinn, Lauterkeit des Charakters, allen, hoch und niedrig, gleichmäßig theuer.",1795,119636131,0,1,http://www.deutsche-biographie.de/sfz95585.html
"Grube, Elisabeth",1803 bis 1871,"Grube: Elisabeth Grube, geborene Diez, Schriftstellerin, geboren in Netphen an der Sieg den 22. October 1803, † in Düsseldorf den 21. April 1871. Ihr Vater war Domänen-Rentmeister. Sie schwärmte schon als Kind für alles Edle und Schöne und dichtete im Alter von zwölf Jahren ein heroisches Schauspiel, das sie mit ihren Gespielen auf einem selbst errichteten Liebhabertheater aufführte. Ihr Wissensdrang führte sie dazu, mit dem Lehrer F. W. Grube in Kirchen, einem jungen Manne, den sie für einen alten Herrn hielt, in Briefwechsel zu treten, weil Grube eine Leihbibliothek errichtet hatte, die sie eifrig benutzte. Aus der späteren persönlichen Bekanntschaft erfolgte 1823 ihre Vermählung mit demselben. Ein Auszug ihres Briefwechsels ist 1835 im|""Hermann"" abgedruckt. 1827 folgte sie ihrem Gatten nach Düsseldorf, wo er eine Anstellung bei der königl. Regierung angenommen hatte, und blieb auch dort wohnen, als derselbe 1845 auf einer Reise nach China, die er im Auftrag der Regierung zur Förderung der Handelsinteressen unternommen, gestorben war. Sie widmete sich neben der Erziehung ihrer Kinder und ihren schriftstellerischen Arbeiten mit besonderer Sorgfalt der Linderung aller Nothstände und erwarb sich als Wohlthäterin der Armen, Pflegerin und Trösterin der Kranken und Elenden seltene Verdienste. Als Schriftstellerin veröffentlichte sie ""Liederkranz"" (1842) und ""Wiesenblumen von der Sieg und Feldblumen vom Rhein"" (1847), beide Sammlungen in Gemeinschaft mit ihrer begabten Schwester Katharina Diez, ""Gedichte"" (1857) und die Dramen ""Jacobe von Baden"", ""Wittekind"" und ""Die Lützower"" (1864), sowie viele Erzählungen und Gedichte in Zeitschriften. Entschlossene Wahrheitsliebe, männlicher Verstand, reiches Wissen und echte Religiösität zeichneten sie vortheilhaft aus und verliehen auch ihren fließend gereimten Dichtungen tieferen Gehalt. ",1855,116117249,0,1,http://www.deutsche-biographie.de/sfz24126.html
"Krotschmit, Nikolaus","erwähnt 1535, gestorben 1561","Krotschmit: Nikolaus Krotschmit (Krottenschmidt), Annalist, † am 15. October 1561 in Naumburg a. d. Saale, wo er 1535—1546 als Dr. jur. und Stadtschreiber nachweisbar ist. Im J. 1537 hatte er den Rath der Stadt Naumburg beim Reichskammergericht in Speier wider die Anklagen des Bischofs Philipp in Religionsangelegenheiten zu vertheidigen. Während seiner Stadtschreiberzeit (sicher 1539) und noch ein Jahr darüber hinaus stellte er auf Grund städtischer Archivalien sowie einer 1502 von seinem Amtsvorgänger Erhard Milde begonnenen Chronik, die aber verloren gegangen ist, schätzbare Naumburger Annalen für die Jahre 1305—1547 zusammen, die vom Bürgermeister Sixtus Braun später in seine Naumburger Annalen verarbeitet und neuerdings (Naumburg 1891) durch Dr. Köster in den Druck gegeben worden sind. Auch gilt K., doch ohne sicheren Beweis, als Verfasser eines ausführlichen Berichtes über Wahl und Einführung des Bischofs Nikolaus v. Amsdorf in Naumburg 1542, veröffentlicht durch K. P. Lepsius in den Neuen Mittheilungen des Thüringisch-Sächsischen Vereins II, 155 ff.",1071,133001210,0,1,http://www.deutsche-biographie.de/sfz46226.html
"Rehle, Johann",1814 bis 1846,"Rehle: Johann Rehle, Maler und Xylograph, geb. 1814 zu Neuburg an der Donau. Machte sich als Knabe durch viele, mit der schweren ungefügen Schneiderscheere seines Vaters höchst geschickt in Papier ausgeschnittene Silhouettenporträts und Charakterfiguren bemerkbar, kam deshalb auf die Akademie nach München, wurde daselbst mit Kaspar Braun bekannt und für die Xylographie gewonnen. Mit Unterstützung des Advocaten C. B. v. Dessauer gingen R. und Braun zu ihrer weiteren Ausbildung nach Paris 1838 und vervollkommneten sich in der Holzschneidekunst bei Breviers. Nach ihrer Rückkehr entstand die anfänglich von Braun u. Dessauer, dann unter der Firma Braun u. Schneider wirklich weltbekannt gewordene xylographische Anstalt. Daselbst schnitt R. einen großen Theil der (nach Julius Schnorr's Originalen von Alexander Strähuber auf Holz gezeichneten) Illustrationen zur Prachtausgabe des ""Nibelungenliedes"" (Stuttgart 1840), des ""Götz von Berlichingen"" (nach Zeichnungen von Eugen Neureuther) und zur ""Braut von Messina"", wozu R. eigene Composition lieferte. Außerdem schnitt R. viele Holzstöcke für die ""Fliegenden Blätter"", für die ""Münchener Bilderbogen"" und etliche Kinderbücher (""Buch für fromme Kinder""), darunter wieder auch nach eigenen Zeichnungen. Im J. 1845 schied R. aus dem Atelier von Braun u. Schneider, um mit E. Roller ein eigenes Geschäft zu begründen, starb aber schon am 20. Decbr. 1846. Zu Rehle's selbständigen Leistungen als Künstler gehören neun Blätter geistreicher und höchst charakteristisch erfundener Bleistiftzeichnungen zu Hebel's ""Karfunkel"", von denen aber nur ein Blatt (: ""'s chumt e Chnab ans Fenster mit lockiger Stirnen und rueft ein"":) von C. Volz in Kupferstich vervielfältigt wurde. R. malte auch einige kleine, leider verschollene Oelbilder.",1780,130252476,0,1,http://www.deutsche-biographie.de/sfz75875.html
"Bergmann, Michael Adam",1733 bis 1782 oder 1783 ,"Bergmann: Michel Adam v. Bergmann, geb. 15. Aug. 1733 zu München, † 1783, studirte auf der hohen Schule zu Ingolstadt die Rechtswissenschaft und gewann dort Ickstädt und Lori zu Gönnern und Freunden. Noch als Student verfaßte er die Schrift ""De ducum Bojoariae jure regio"", die er, in die Vaterstadt zurückgekehrt, herausgab. Sie erregte namentlich durch die freimüthige Behandlung der Frage, ob den Landesfürsten das jus regium in ecclesiasticis zustehe, großes Aufsehen und rief eine Reihe von Streitschriften pro et contra hervor. Die neugegründete Akademie der Wissenschaften ernannte den Verfasser 1759 zum Mitglied und nicht ohne Schwierigkeiten erlangte er auch eine Anstellung beim Stadtmagistrat. Seit 1762 versah er das Amt eines Stadtoberrichters und seine treffliche Amtsverwaltung bewog die Mitbürger, ihm auch die Bürgermeisterwürde zu übertragen. Trotz dieser ausgebreiteten amtlichen Thätigkeit ließ er sich doch die Mühe nicht verdrießen, auch die Stadtarchive in Ordnung zu bringen und Material zu einem Urkundenbuch zu sammeln, das unter dem Titel ""Monumenta civitatensia"" erscheinen sollte. Er starb aber vor der Vollendung der Arbeit am 20. Mai 1783. Das Gesammelte wurde von Stiftsdechant v. Effner unter dem Titel ""Beurkundete Geschichte der kurfürstlichen Haupt- und Residenzstadt München"" herausgegeben.",1328,116133341,0,1,http://www.deutsche-biographie.de/sfz11350.html
"Thebes, Adam",1596 bis 1652,"Thebes: Adam Thebes (oder Thebesius) wurde am 6. December 1596 zu Seiffersdorf bei Liegnitz geboren, wo sein Vater, Peter Th., Pastor war. Auch sein Großvater Adam Th. und sein Urgroßvater Johann Th. waren Geistliche. Er besuchte die Stadtschule in Liegnitz und das Gymnasium Magdalenum in Breslau und bezog Ostern 1616 die Universität Wittenberg, um Theologie zu studiren. Hier ward er schon im J. 1617 Magister. Da sein kranker Vater seiner Hülfe im Predigen bedurfte, verließ er im J. 1619 die Universität, wurde aber schon in demselben Jahre nach Mondschütz im Fürstenthum Wohlau als Pastor berufen, von wo er im Januar 1627 als Pastor nach Wohlau kam. Im J. 1621 hatte er geheirathet. Pest und Kriegsnoth suchten ihn in Wohlau mannichfach heim; er verlor mehrere Kinder und Anfangs des Februar im J. 1629 auch seine Frau. Im Mai 1639 wurde er als Pastor an die Oberstadtpfarrkirche in Liegnitz berufen; hier wurde er 1642 auch Assessor des fürstlichen Consistoriums und starb nach vielen Krankheitsfällen am 12. December 1652 am Schlagfluß. Er verwandte auf seine Predigten einen besonderen Fleiß; besonders war er bemüht, logisch, der Gemeinde verständlich und unter Anwendung ausschließlich deutscher Ausdrücke zu predigen, was manche andere Prediger ihm nachthaten und die ""Thebesianische Methode"" (methodus Thebesiana) nannten. Wegen seiner dichterischen Begabung wurde er im J. 1638 zum poeta laureatus ernannt. Unter seinen geistlichen Liedern ist das bekannteste, das namentlich noch in Schlesischen Gesangbüchern sich findet, das Passionslied: ""Du großer Schmerzenmann vom Vater so geschlagen"".",1607,120333422,0,1,http://www.deutsche-biographie.de/sfz82400.html
"Clüver, Alverich",1464 bis 1557,"Clüver: Alverich Clüver, der Aeltere, in allen Zwistigkeiten und allen Verhandlungen der bremischen Stände mit Erzbischof Christoph der Führer der Ritterschaft, so auch in der Tohopesate, † 7. Mai 1557, 93 Jahr alt, tritt am meisten aus dem mächtigen und gewaltigen Geschlechte der C. hervor, das durch seine Besitzungen und seine Zahl in der Geschichte der Lande zwischen Elbe und Weser eine große Rolle spielte, aber weil es dem Dienste der Fürsten sich fern hielt, weniger hervortritt. Die Schlepegrelle und die Schock sind mit ihnen eines Stammes, der sich noch früher die Klaven, nach der Bärenklaue im Wappen, nannte, und wie v. Hammerstein nach dem sehr großen zusammenhängenden Besitz und ihren Gerichten vermuthete am eine Dynastenfamilie zurückzuführen ist. Nach ihren Burgen heißen einige gelegentlich von Clüversborstel und von Clüvershagen. Der Name wird stets als Beiname, z. B. ""Alverich der Clüver"" (= der mit der Klaue) gebraucht: noch sehr stark an Kopfzahl am Ende des 16. starben sie aus im 18. Jahrhundert. Johann der C. spielte im Streite Erzbischofs Otto von Bremen gegen den Tompropst Johann Monnick (oder von Bremen) 1397 eine Rolle durch Behauptung der Burg Ottersberg. In Mecklenburg starben die Clauen oder Klaven um 1390 aus.",1254,136185983,0,1,http://www.deutsche-biographie.de/sfz8515.html
"Bielitz, Gustav Alexander",1769 bis 1841,"Bielitz: Dr. Gustav Alexander Bielitz, bekannter preußischer Civilist, geb. 27. Mai 1769 zu Liebenwerda, wo sein Vater Justizamtmann war, und † zu Naumburg a. d. S. im Mai 1841; studirte in Wittenberg, begab sich dann nach Dresden, wo er bis 1811 prakticirte, zugleich aber auch litterarisch thätig war. Im J. 1819 wandte er sich nach Naumburg a. d. S., wo er privatisirend mehrere Schriften, besonders aber den ""Commentar zum Allgemeinen Landrechte für die preußischen Staaten"" verfaßte. Dieser ""Praktische Commentar"", der in acht starken Bänden, 1823—30 (Bd. 1 in 2. Ausg. 1835) nebst zwei Heften Nachträge 1831 und 1832 erschien, ist die erste große civilistische Leistung über das|preuß. Landrecht, die, dem Gesetzbuche in dessen Anordnung folgend, den ganzen umfangreichen Stoff in klarer und faßlicher Darstellung enthält. Auf ihr fußt die Reihe trefflicher Commentatoren des preußischen Rechts, die vorläufig in Koch ihren Abschluß fand. Als sonstige Arbeiten sind noch hervorzuheben: ""Die preußische Justizverfassung in ihrer Eigenthümlichkeit verglichen mit der sächsischen"", 1817. 1818. ""Handbuch des preußischen Kirchenrechts"", 1818. 2. Aufl. 1831. ""Erläuterungen des preußischen Gesetzes über den Mandats-, summarischen und Bagatellproceß vom 1. Juni 1833"", 1833 nebst Ministerial-Instruction. ""Analyse und Erläuterung des preußischen Gesetzes über das Rechtsmittel der Revision und Nichtigkeitsbeschwerde vom 14. December 1833"", 1834. Außerdem schrieb B. viele Abhandlungen für die ""Kameralistische Zeitung"" (z. B. ""Darstellung der Rechte des preußischen Fiscus"", 1839 und ""Darstellung der Rechtsverhältnisse des Adels in Preußen"", 1840) und Hinschius' Juristische Wochenschrift. Ein vollständiges Verzeichniß seiner Arbeiten steht in Engelmann's Bibliotheca juridìca. Leipzig 1840. 1849. ",1802,132498081,0,1,http://www.deutsche-biographie.de/sfz4423.html
"Bornhauser, Thomas",1799 bis 1856,"Bornhauser: Thomas Bornhauser, theologischer Geistlicher, Staatsmann und Schriftsteller, geb. 1799 zu Weinfelden, † März 1856 zu Mühlheim. — Sohn eines Bäckers und Krämers widmete sich B. mehr aus allgemeinem Drange nach höherer Bildung, als besonderer Vorliebe dem geistlichen Amte. Bedeutungsvoller, als die Besorgung der Pfarreien in Matzingen, Arbon und Mühlheim, ist denn auch für seinen ganzen Lebensgang die Theilnahme an den öffentlichen politischen Angelegenheiten geworden. Durch seine feurige Thätigkeit als Publicist und Volksredner arbeitete er mehrere Jahre auf eine demokratische Veränderung der thurgauischen Cantonsverfassung hin, bis er und seine Freunde es an der Zeit fanden, am 22. Oct. 1830 durch eine große Volksversammlung in Wein felden das Signal zu der durchaus erfolgreichen Umwälzung zu geben. Schon nach sechs Jahren wurde indeß diese neue Verfassung mit einer von B. als überflüssig erachteten noch neueren vertauscht. Der politische Pfarrer kam durch diese Bewegungen von 1837 in den Hintergrund und lebte 12 Jahre lang in Zurückgezogenheit seinen Musen. Als aber nach dem Sonderbundskriege das thurgauische Volk wieder das Bedürfniß nach einer Verfassungsrevision fühlte, zog es seinen alten Wecker noch einmal aus seinem Stillleben hervor und stellte ihn an die Spitze des Verfassungsraths, der seine Aufgabe zur Zufriedenheit der großen Mehrheit löste. — Die lyrischen, dramatischen und epischen Dichtungen Bornhauser's sind seiner Zeit viel gelesen worden, doch unbedingt mehr wegen ihrer vaterländischen Stoffe und patriotischen Gesinnungen, als wegen ihrer poetischen Schönheiten.",1618,133373177,0,1,http://www.deutsche-biographie.de/sfz5347.html
"Meilinger, Andreas Florian",1763 bis 1837,"Meilinger: Andreas Florian Meilinger, geb. am 29. November 1763 in Landshut, † in München am 30. November 1837, Sohn eines Gärtners, machte seine Gymnasialstudien in seiner Vaterstadt und trat 1783 in den Benedictinerorden ein, in welchem er zunächst das Noviciat in Roth am Inn durchlebte und dann (1784) in Benedictbeuern Profeß ablegte, wobei er den Klosternamen Florian annahm. Nachdem er 1787 die Priesterweihe empfangen und einige Zeit als Expositus in Walchensee gewirkt hatte, sandte ihn der Orden als Professor an das Gymnasium zu Freising (— es hatten nämlich nach Aufhebung des Jesuitenordens die Benedictiner fast sämmtliche Studienanstalten Baierns übernommen, ein Verhältniß, welches bis zur Säcularisation 1803 dauerte —), woselbst er 1794 die Professur der Philosophie am Lyceum zugewiesen erhielt. Zu gleicher Function wurde er 1796 nach Benedictbeuern zurückgerufen und sodann 1801 an die damalige Universität Salzburg geschickt; als aber Salzburg an Oesterreich fiel (1803), wurde er von der bairischen Regierung am Lyceum zu Passau angestellt, von wo er 1807 an das Münchener Lyceum berufen wurde, dessen Rectorat er 1823 erhielt. Bei Verlegung der Universität von Landshut nach München (1826) wurde ihm eine ordentliche Professur der Philosophie übertragen und zugleich ein Theil des Unterrichtes der königlichen Prinzen anvertraut;|1832 trat er als Mitglied in den obersten Schulrath ein. Seine Schriften ""Grundriß der Logik und Metaphysik"" (1821, 3. Aufl. 1835) und ""Grundriß der Moralphilosophie und des Naturrechts"" (1827) erheben sich nicht über das Niveau der in klerikalen Anstalten üblichen Schulphilosophie; außer diesen verfaßte er ""Pädagogische Bemerkungen über die vaterländischen Gymnasien"" (1826) und eine Rectoratsrede ""Ueber den Sinn und die Bedeutung der akademischen Gesetze"" (1828).Th. Siber, Gedächtnißrede auf A. Fl. Meilinger (1837).",1876,116862424,0,1,http://www.deutsche-biographie.de/sfz59941.html
"Rasch, Johannes",erwähnt 1572,"Rasch: Johannes Rasch, ein fleißiger Componist des 16. Jahrhunderts, von dem sich noch mehrere seiner Druckwerke auf öffentlichen Bibliotheken er halten haben. Man wußte bisher über das Leben des Mannes nichts Näheres und kannte nur die Drucke auf der königlichen Staatsbibliothek in München, bis ich auf der Baßstimme des Salve Regina von 1572 die alte handschriftliche Notiz fand: ""Praeceptor in coenobio Griuensi, in Carinthia"", d. h. wohl im Kloster Griffen bei Völkermarkt in Kärnten. Ein Präceptor war sowol in Klöstern als an jeder größeren Musikcapelle in früherer Zeit angestellt, denn da der Discant einst nur von Knabenstimmen gesungen wurde, so errichtete man an den Musikcapellen ein sogenanntes Alumnat, worin die Knaben erzogen und für ihre spätere Fortbildung gesorgt wurde. Dies war die Pflanzstätte der späteren Musiker, und selbst unsere größten Meister älterer Zeiten waren einst Alumnen solcher Anstalten. Hier wurden sie nicht nur in den Elementarkenntnissen unterrichtet, sondern auch in Sprachen und Wissenschaften und konnten darauf die Universität beziehen. Die Musik war einer der ersten Unterrichtsgegenstände und sie wurden nicht nur im Gesange und im Instrumentenspiel geübt, sondern in der Compositionslehre, im Contrapunkt und der Klanglehre. Die Monatshefte für Musikgeschichte bringen in ihrem 19. und 20. Jahrgange sehr interessante archivalische Berichte über diesen Gegenstand. Die von R. herausgegebenen Werke bestehen aus einem ""Salve regina"" zu sechs Stimmen, ""Cantiunculae pascales"", ""Cantica ecclesiastica"", 4 voc. und ""In monte olivarum"". Alle erschienen 1572 in München bei Ad. Berg. Die Staatsbibliothek in München besitzt noch im Manuscript (Nr. 1640, 135 Codex des 16. und 17. Jahrhunderts mit deutscher Orgeltabulatur) einen Gesang von einem Simon Rasch, über den uns jegliche weitere Nachricht fehlt.",1849,143140175,0,1,http://www.deutsche-biographie.de/sfz75634.html
"Schorlemmer, Ludwig Wilhelm von",1699 bis 1776,"Schorlemmer: Ludwig Wilhelm v. Schorlemmer, preußischer Generallieutenant, 1699 im Hessischen geboren, 1718 beim Regiment zu Pferd von Dewitz in den preußischen Dienst getreten, am 29. Nov. d. J. zum Cornet ernannt, war beim Regierungsantritt Friedrich II. Major beim Kürassierregiment von Waldow Nr. 12, ward nach der Schlacht bei Chotusitz (17. Mai 1742) Oberst, that sich bei Hohenfriedberg (4. Juni 1745) hervor, erhielt den Orden pour le mérite, ward 1747 Generalmajor und in demselben Jahre Chef des Dragonerregiments Nr. 6, welches in ostpreußischen Garnisonen stand. Er war ein tüchtiger Dienstofficier; es war ihm daher schon damals eine ähnliche Stellung angewiesen, wie nach dem siebenjährigen Kriege die Inspecteure einnahmen. Weniger zufriedenstellend waren seine Leistungen in letzterem Kriege. Schon bei Großjägerndorf (30. August 1757) ward ihm Schuld gegeben, daß die vor der Schlacht ihm aufgetragen gewesene Erkundung des Feindes nicht genügend gewesen sei; es ward ihm ferner vorgeworfen, daß er, nachdem sein anfänglich vorzüglich geglückter Angriff auf den rechten Flügel der Russen abgewiesen war, zu weit zurückgegangen sei und weiter nichts gethan habe. Am 9. August 1758 schreibt der König (Politische Correspondenz Friedrichs II., 17. Band, Berlin 1889) von ihm, daß er ""sein Lebtage nichts thun will, sondern sitzet und kalmäusert"". Trotzdem führte er gleich darauf bei Zorndorf (25. August 1758) und im folgenden Jahre bei Kay (23. Juli) und bei Kunersdorf (12. August) höhere Commandos, ohne jedoch hervorzutreten. Er wurde 1760 verabschiedet und starb am 14. Mai 1776 zu Berlin.",1609,138197431,0,1,http://www.deutsche-biographie.de/sfz79065.html
"Schenck von Grafenberg, Johann",1530 bis 1598,"Schenck: Johannes Schenck von Grafenberg, einer der angesehensten Aerzte seiner Zeit, wurde am 20. oder 21. Juni 1530 zu Grafenberg geboren, daher zum Unterschiede von den anderen Aerzten seines Namens durch diesen Zusatz ausgezeichnet. Er machte seine Studien in Tübingen, besonders als Schüler von Schegk und Fuchs, erwarb 1554 daselbst die Doctorwürde, ließ sich in Straßburg als Arzt nieder, wurde jeddch schon kurze Zeit danach als Stadtphysicus nach Freiburg im Breisgau berufen und war hier als solcher bis zu seinem Tode, der am 12. September 1598 erfolgte, unermüdlich thätig. Sein mit Recht berühmtes Hauptwerk ist betitelt: ""Παρατηρησεων sive observationum medicarum rararum, novarum, admirabilium et monstrosarum volumen etc."" (Basel und Freiburg 1584—97, 7 Bände und viele weitere Ausgaben; zuletzt Lyon 1644). Es ist dieses Werk deshalb so bemerkenswerth und verdienstvoll, einmal weil in ihm sich schon eine Berücksichtigung der pathologischen Anatomie findet und dann, weil es eine Sammlung vieler eigener, aber auch von anderen Aerzten angestellter, wichtiger Beobachtungen über die Krankheiten der einzelnen Körpertheile enthält, Beobachtungen, die sicher sonst verloren gegangen, oder in Vergessenheit gerathen wären, wenn S. sich nicht die Mühe gegeben hätte, sie zusammenzustellen. Es geht dies Werk bis auf Hippokrates zurück.",1348,100332285,0,1,http://www.deutsche-biographie.de/sfz78158.html
