name,date,leben,lengthleben,idn,iplace,ibio,url
"Pummerer, Rudolf",1882 bis 1973,"P. besuchte das Gymnasium in Kremsmünster und, nach dem Umzug der Familie 1896, in München. Seit 1900 studierte er an der Univ. München Chemie bei →Adolf v. Baeyer, Heinrich Wieland, →Johannes Thiele und →Richard Willstätter, bei dem er 1905 mit einer Untersuchung der Pyrone promoviert wurde. Zunächst arbeitete er als unbezahlter Assistent, nahm dann auf Anraten Baeyers eine Stelle im Farbenlabor der BASF an, und befaßte sich mit Indigosynthesen. Obwohl seine Industrietätigkeit sehr erfolgreich verlief (12 Patente in zweieinhalb Jahren), kehrte er 1908 an die Universität zurück, forschte hier erneut unentgeltlich als Privatgelehrter und nahm nebenher Industrieaufträge an. Nach seiner Habilitation 1911 (Unteres, in d. Indigo-Gruppe) wurde er Lehrbeauftragter für Technische Chemie. Bei Kriegsausbruch 1914 diente P. zunächst in der Infanterie, seit 1915 als Chemiker in der Pulverfabrikation in Ingolstadt, 1917/18 bei Fritz Haber in Berlin-Dahlem. Hier studierte er die Verwendung von Synthesekautschuk in Gasmasken. 1919 kehrte er nach München zurück und begann mit dem Aufbau einer Vorlesungssammlung von Produkten der chemischen Industrie. 1921 wurde P. ao. Professor und Vorstand der organisch-chemischen Abteilung des „Staatslaboratoriums“ der Bayer. Akademie der Wissenschaften. 1923 folgte er einem Ruf auf den Lehrstuhl für Chemie an der Univ. Greifswald, seit 1925 war er Ordinarius an der Univ. Erlangen (Rektor 1931/32, em. 1952).P.s wissenschaftliche Arbeiten behandeln ausschließlich Fragen der organischen Chemie. Untersuchungen zur Indigosynthese führten zu Erkenntnissen über die Zusammenhänge von Farbe und Konstitution; bei der Dehydrierung substituierter Phenole gelang P. erstmals der Nachweis von Sauerstoffradikalen, und die von ihm postulierte Valenztautomerie zur Stabilisierung derselben wies bereits auf den 1933 von →Christopher Ingold (1893–1970) eingeführten Mesomeriebegriff. Aufbauend auf diesen Ergebnissen folgten Arbeiten zur Kondensation von Chinonen und Überlegungen zur Entstehung hochmolekularer Naturstoffe wie Lignin über Kondensationsreaktionen. P. befaßte sich auch mit der Konstitution des Naturkautschuks, dessen Bau bzw. Molekülgröße er durch Hydrierung und „Ozonisierung“ (Spaltung d. Doppelbindungen mit Ozon) zu bestimmen suchte, wobei hier die Arbeiten Hermann Staudingers (1881–1965) früher zu bleibenden Resultaten führten, allerdings ohne zunächst anerkannt zu werden. P. war Herausgeber (1947/48) bzw. Mitherausgeber (1949/50) der Zeitschrift „Angewandte Chemie“ und Herausgeber der „Sammlung chemischer und technischer Vorträge“ (seit 1937).|",2606,117705721,1,1,http://www.deutsche-biographie.de/sfz48684.html
"Hatschek, Julius",1872 bis 1926,"H. studierte Rechtswissenschaften in Leipzig, Czernowitz, Wien und Heidelberg, promovierte 1895 in Czernowitz und habilitierte sich 1898 als Schüler Georg Jellineks in Heidelberg für öffentliches Recht mit einer Arbeit über die Bedeutung der Selbstverwaltung. Zunächst Privatdozent, dann außerplanmäßiger Professor in Heidelberg, wurde er 1905 als außerordentlicher Professor an die Preußische Verwaltungsakademie in Posen berufen. Von dort 1907 zur Lehrtätigkeit bei der Vereinigung für staatswissenschaftliche Fortbildung in Berlin beurlaubt und gleichzeitig Hilfsarbeiter im Preußischen Unterrichtsministerium, erhielt er 1909 einen Ruf an die Rechts- und Staatswissenschaftliche Fakultät der Universität Göttingen. Dort lehrte H. seit 1909 als außerordentlicher Professor, seit 1921 als persönlicher Ordinarius für Staats-, Verwaltungs- und Völkerrecht und nahm zugleich seit 1918 (als  Mitglied des Arbeitsausschusses der Universität Göttingen für die Abhaltung von Vorlesungen aus den Gebieten des anglo-amerikanischen Rechtskreises) einen Lehrauftrag für englisches Recht wahr.Im Zentrum seines umfangreichen literarischen Werkes stand das englische Verfassungs- und Verwaltungsrecht. H. beschloß die Reihe der deutschen Juristen (Ludwig von Vincke, K. J. A. Mittermaier, Rudolf von Gneist, Georg Jellinek), die sich eingehend mit der englischen Verfassungs-, Verwaltungs- und Rechtsentwicklung beschäftigten. Sie erblickten darin ein Vorbild für den Ausbau einer deutschen rechtsstaatlichen konstitutionellen Monarchie, die im 19. und zu Anfang des 20. Jahrhunderts unüberhörbar gefordert wurde.Wenn auch schon Gneist über die politischvergleichende Methode hinaus auch rechtsvergleichend gearbeitet hatte, jedoch das fremde Recht mit den Begriffen des eigenen Rechts darzustellen versuchte, kann H. als der eigentliche Begründer einer modernen Rechtsvergleichung im öffentlichen Recht angesehen werden, der das fremde (hier vor allem das englische) Recht aus dessen spezifischen Rechtsbegriffen und sozialen Verhältnissen heraus zu verstehen lehrte. Diese strenge rechtsvergleichende Methode wurde von H. verschiedentlich durch Hinweise und Untersuchungen rechtssoziologischer Natur (vor allem in seinem „Britischen und Römischen Weltreich“, 1921) ergänzt und ausgebaut. Von der Beschäftigung mit dem englischen Recht gelangte H. später zum Parlamentsrecht; sein leider unvollständig gebliebenes Werk „Das Parlamentsrecht des Deutschen Reiches“ (1. Teil, 1915) (das ebenfalls wesentliche rechtsvergleichende Hinweise enthält) hat bis heute noch keine Nachfolge gefunden. In seinen letzten Lebensjahren widmete er sich vor allem dem Staats- und Verwaltungsrecht der Weimarer Republik und des hegemonialen|Preußen – seine beiden umfangreichen Werke fanden Beachtung auch noch in nach seinem Tode erfolgten Bearbeitungen, sein Verwaltungsrecht erfuhr 1919-32 sieben Auflagen – und zunehmend dem Völkerrecht. Sein früher Tod begrub die Hoffnungen, die gerade auf diesem letzteren Gebiet in den kenntnisreichen und fruchtbaren Autor gesetzt worden waren.",3058,11651891X,1,1,http://www.deutsche-biographie.de/sfz28129.html
"Scheibe, Arnold",1901 bis 1989,"S. besuchte das Humanistische Gymnasium in Greiz, erlernte 1921-23 die Landwirtschaftspraxis in zwei schles. Großbetrieben und studierte dann bis 1926 Landwirtschaft und Naturwissenschaften an der TH München und der Univ. Göttingen. 1927 wurde er in München bei Ludwig Kießling (1875–1942) mit Untersuchungen über die Transpirationsverhältnisse beim Weizen und deren Auswertung für Pflanzenzüchtung und Kulturpflanzenökologie promoviert. Gleichermaßen prägend für ihn waren die anschließenden Arbeiten bei Otto Appel (* 1867) an der Biolog. Reichsanstalt in Berlin-Dahlem zur Resistenzzüchtung beim Getreide (1928–31) und ein dreijähriger Aufenthalt in Eskishehir (Anatolien) zum Aufbau einer türk. Landessaatzuchtanstalt. Nach seiner Rückkehr habilitierte sich S. 1935 in Gießen „Über die Wildzuckerrüben Anatoliens“. Im selben Jahr leitete er die viel beachtete Expedition der „Notgemeinschaft der Dt. Wissenschaft“ in den zentralasiatischen Hindukusch zur Erforschung der Abstammungsverhältnisse und zur Sammlung von Wild- und Kulturpflanzen für die dt. Pflanzenzüchtung (Deutsche im Hindukusch, Ber. d. Dt. Hindukusch-Expedition 1935 d. DFG, 1937). 1941 wurde er aus dem Kriegsdienst in Frankreich als Nachfolger von Kießling zum o. Professor und  Direktor des Instituts für Acker- und Pflanzenbau an die TH München berufen. Daneben wurde er 1942 zum Direktor des neu gegründeten KWI für Landwirtschaftliche Forschungen in Sofia (Bulgarien) ernannt. Nach seinem Ausscheiden aus der TH München 1946 begründete S. 1948 im Rahmen der MPG eine Forschungsstelle für Pflanzenbau und Züchtungsbiologie auf dem Neuhof bei Gießen, die 1951 als Abteilung in das MPI für Züchtungsforschung eingegliedert wurde. Gleichzeitig wurde er auf den neugeschaffenen Lehrstuhl für Grünlandwirtschaft und Futterbau in Gießen berufen. Den Höhepunkt seines Schaffens erreichte er als  Direktor des Instituts für Pflanzenbau und Pflanzenzüchtung an der Univ. Göttingen (1955–70, Rektor 1962–64).S. widmete sich der zentralen Frage der Pflanzenbauwissenschaft, wie die genotypische Reaktionsnorm der Kulturpflanzen in ökophysiologischen Prozessen der Ertragsbildung, insbesondere der Erzeugung wertbestimmender Inhaltsstoffe, zu erkennen und für die Sortenentwicklung nutzbar zu machen sei. Aufbauend auf seinen geobotanischen Erfahrungen und dem umfangreichen Pflanzenmaterial der Hindukusch-Expedition untersuchte er die Variabilität und Genese von Proteinen und Kohlenhydraten in Getreide und Körnerleguminosen, von Fettgehalt und Fettsäuremustern in Saflor, Raps und Mohn bis hin zu den Bitterstoffen im Steinklee und Alkaloiden im Mohn. Als einer der ersten nutzte er die systematische Mutationsauslösung durch Röntgenstrahlen und Chemikalien zur experimentellen Domestikation von Wildformen und Herstellung züchterisch erwünschter Genotypen, wie Futtergräsern mit festem Kornsitz, Rotklee mit kurzer Blütenröhre oder Cumarin-armen Steinkleeformen. Besondere Aufmerksamkeit widmete er einer spontanen fasciata-Mutante der Erbse, deren Vorteile für eine Verbesserung der Standfestigkeit und der Ertragsstruktur er nicht nur mit neuen, anbaufähigen Sorten demonstrierte, sondern die er auch zu genphysiologischen Studien über die Ursachen dieser Sproßveränderung heranzog, um durch besseres kausales Verstehen der veränderten Stoffwechselwege die Züchtung mit dieser Mutation optimierbar zu machen.|",3380,140536957,1,1,http://www.deutsche-biographie.de/sfz111275.html
"Meißner, Georg",1829 bis 1905,"M. studierte 1849-53 in Göttingen Medizin. Unter seinem Lehrer Rudolf Wagner entwickelte er eine ausgeprägte Neigung zu mikroskopischen Arbeiten. Mit seinem Studienfreund Theodor Billroth begleitete er im Sommer 1851 Wagner auf einer Reise nach Triest, die der Erforschung des Nervensystems des Zitterrochens galt. Hieran anknüpfende mikroanatomische Untersuchungen über die sensible Nervenversorgung der menschlichen Haut führten M. als Studenten zur bedeutenden Entdeckung der später nach ihm benannten Tastkörperchen, welche zuerst 1852 von Wagner und M. gemeinsam publiziert wurde. Weitere eigene Arbeitsergebnisse zu diesem Gegenstand legte M. in seiner Dissertation über die Anatomie und Physiologie der Haut vor (1853). Durch anschließende Studienaufenthalte in Berlin bei dem Physiologen Johannes Müller und in München bei dem Zoologen Carl Theodor v. Siebold erweiterte er seine biologischen Kenntnisse. Nach Arbeiten unter Wagner über das Eindringen von Samenelementen ins Ei bei verschiedenen Tierarten und über die Gesetzmäßigkeiten der menschlichen Augenbewegungen habilitierte er sich 1855 in Göttingen für Physiologie, allgemeine und vergleichende Anatomie. In dieser Zeit geriet er mit Wagner in einen Prioritätsstreit um die Tastkörperchenentdeckung. Noch 1855 folgte M. einem Ruf als o. Professor der Anatomie und Physiologie nach Basel, wo er die Erstbeschreibung des unter der Darmschleimhaut gelegenen nervösen Plexus myentericus internus gab. 1857 als Professor der Physiologie nach Freiburg im Breisgau berufen, begann er dort eine Reihe grundlegender Versuche zur Magen- und Pankreasverdauung von Eiweißen. Durch Vermittlung des befreundeten Göttinger Anatomen Jacob Henle erfolgte Anfang 1859 die Aussöhnung M.s mit Wagner. Als dieser 1860 vom Lehrfach Physiologie zurücktrat, wurde M. auf Göttingens ersten eigenen Lehrstuhl für Physiologie berufen. Hier wirkte er als o. Professor bis zu seiner Emeritierung 1901. Mit moderner experimental-physiologischer Methodik widmete er sich in dieser Zeit vornehmlich Stoffwechseluntersuchungen, insbesondere zur Entstehung der Hippur- und Bernsteinsäure im tierischen Organismus. Während er auf physiologisch-chemischem Gebiet volle Anerkennung fand, wurde seine Versuchsmethode zum Studium der Elektrophysiologie des Muskels von Emil Du Bois-Reymond, dem führenden Fachmann, mit sachlicher Berechtigung, wenngleich in unverhältnismäßig scharfer Form, kritisiert. Als gegen seine elektrochemischen Untersuchungen über Sauerstoff und Ozon ebenfalls grundsätzliche methodische Einwände vorgebracht wurden, entschloß sich M., durch solche Kritik gekränkt, nach einer letzten Publikation über Ozonerzeugung 1871 zum Verzicht auf weitere eigene wissenschaftliche Veröffentlichungen. Dieser literarische Rückzug brachte in den folgenden Jahrzehnten auch eine institutionelle Stagnation der Göttinger Physiologie mit sich. Bei fortgesetzter Forschungstätigkeit gingen dennoch aus der Reihe von M.s Assistenten mit den Physiologen Heinrich Boruttau und Otto Weiß, dem Pharmakologen Wilhelm Marmé und dem Hygieniker →Carl Flügge namhafte Wissenschaftler hervor.",3120,118580329,1,1,http://www.deutsche-biographie.de/sfz60091.html
"Rosengart, Siegfried",1894 bis 1985,"R. kam durch seinen Onkel Joseph früh mit bildender Kunst in Berührung. Zum prägenden Erlebnis wurde für ihn der Besuch der Sonderbund-Ausstellung in Köln 1912, die einen Überblick über die damalige Kunst der Moderne bot. Während seines Französischstudiums in Paris 1913/14 lernte er durch Wilhelm Uhde Picasso kennen und gewann seinen Onkel Heinrich Thannhauser dafür, Picassos „Les Saltimbanques“ von 1905 (heute Nat. Gallery of Art, Washington D. C.) zu ersteigern. 1919 trat R. in die Galerie seines Onkels ein und eröffnete für ihn 1920 in Luzern eine Filiale, die er bis 1937 leitete. 1933 erhielt er die Schweizer Staatsbürgerschaft; vier Jahre später trennte er sich von Thannhauser, um die Galerie selbständig weiterzuführen.Schwerpunkte seines Kunsthandels waren die Meister der Klassischen Moderne, v. a. Picasso, dem er besonders nahestand, und →Paul Klee, den er nach dem Krieg durch eigene Ausstellungen bekanntmachte. Zusammen mit seiner Tochter, die 1948 Mitarbeiterin und 1957 Teilhaberin der Galerie wurde, vermittelte er Kunstwerke an Museen, wie etwa die von →Werner Schmalenbach (* 1920) geleitete „Kunstsammlung Nordrhein-Westfalen“ in Düsseldorf und an Sammler in aller Welt, darunter Etta und Claribel Cone (Gauguin, „Frau mit Mango“, Matisse, „Odaliske“, Picasso, „Mutter u. Kind“, heute Baltimore Mus.) und Samuel Courtauld (Manet, „Eine Bar in den Folies Bergère“, London). Über Jahrzehnte war er als Berater und Vermittler für →Bernhard Sprengel (1899–1985) und →Peter Ludwig (1925–96) tätig. Nach dem Krieg begann R. auch selbst zu sammeln und als Mäzen hervorzutreten: Nach Schenkung eines Picasso-Bildes durch ihn und seine Tochter 1971 an das Kunsthaus Zürich richteten beide 1978 der Stadt Luzern im historischen „Am-Rhyn-Haus“ mit acht bedeutenden Werken ein kleines Picasso-Museum ein, dessen Sammlung sie später erweiterten, 1992 durch die rund 200 Picasso-Photographien von David Douglas Duncan.Seit R.s Tod führt seine Tochter die Galerie weiter und gründete 1992 eine gemeinnützige Stiftung mit dem Ziel, ihre und ihres Vaters Sammlung in ihrer Gesamtheit zu erhalten und der Öffentlichkeit in einem Museum zu präsentieren. Im März 2002 wurde es im ehemaligen Gebäude der Schweizer. Nationalbank in Luzern eröffnet. Den Kern der Sammlung bilden 47 Gemälde und Zeichnungen von Picasso aus den Jahren zwischen 1904 und 1972. Mit 125 ausgesuchten Klee-Werken aus allen Schaffensperioden gehört dazu außerdem eine der international bedeutendsten privaten Klee-Kollektionen. Ergänzt werden diese Werkkomplexe durch erlesene Beispiele des Impressionismus und der klassischen Moderne, darunter drei Bilder von Cezanne sowie Gemälde von Monet, Pissarro, Renoir, Seurat, den Nabis-Künstlern Bonnard und Vuillard und Werke von Modigliani, Soutine, Matisse, Braque, Léger, Kandinsky und Miró. Mit einer kleinen Werkgruppe vertreten ist auch Chagall, dem sich Vater und Tochter ebenfalls persönlich verbunden fühlten.|",2945,118840649,1,1,http://www.deutsche-biographie.de/sfz108165.html
"Scherl, August",1849 bis 1921,"Nach Kindheitsjahren in Düsseldorf und Berlin besuchte S. das Dt. Gymnasium in Konstantinopel, wo er bei Freunden der Familie wohnte, sowie bis 1864 die Realschule in Berlin. Er absolvierte eine Lehre im väterlichen Betrieb und übernahm danach die Leitung des Verlags „Duster & Co.“ in Köln, in dem er Kolportageromane v. a. von →Ewald August König (Ps. Ernst Kaiser, 1833–88) herausgab, und zwar über Lotterieunternehmen, die die Romane als Preise aussetzten. Dank des unternehmerischen Erfolgs gründete er 1878 mit seiner späteren Frau in Köln das Flora-Theater und organisierte mit ihr Opern- und Theateraufführungen, was ihn jedoch finanziell ruinierte. Er kehrte Ende der 70er Jahre über Frankfurt/M. nach Berlin zurück, wo er 1883 einen Presse- und Buchverlag gründete (Heribert Kurth & Comp., seit 1888 KG Berliner Lokal-Anzeiger August Scherl & Comp., seit 1895 GmbH, seit 1900 August Scherl GmbH). Das verlegerische Flagschiff bildete zunächst der mit →Hugo v. Kupffer (1853–1928) ins Leben gerufene „Berliner Lokal-Anzeiger“, eine kostenlose Zeitung, die sich über Inserate finanzierte und neben Nachrichten aus aller Welt Fortsetzungsromane enthielt; bereits nach zwei Jahren erschien sie täglich (nun mit d. Untertitel „Zentral-Organ f. d. Reichshauptstadt“; 1944 mit d. „Berliner Morgenpost“ vereinigt). 1889 kam die „Berliner Abend-Zeitung“ hinzu, 1894 die „Neuesten Berliner Handels- und Börsen-Nachrichten“, 1898 das „Berliner Wohnungs-Register“. Für das gebildete Publikum gründete er 1881 die Wochenausgabe „Die weite Welt“, 1899 „Die Woche, Moderne illustrierte Zeitschrift“, 1900 die Tageszeitung „Der Tag“ (ersch. bis 1934), 1901 die monatliche Familienzeitschrift „Vom Fels zum Meer“. „Die Woche“, die 1944 eingestellt werden mußte, gehörte zu den ersten dt. Illustrierten, die den Mehrfarbendruck und die aktuelle Fotoreportage einführten; „Der Tag“ erschien als zweifarbige illustrierte Zeitung. S. erwarb 1903 vom Kröner-Verlag (Stuttgart) die 1853 von →Ernst Keil (1816–78) 1853 gegründete Familienzeitschrift „Gartenlaube“, die er mit „Vom Fels zum Meer“ und „Die weite Welt“ vereinigte und dem Lokalanzeiger als Sonntagsbeilage beifügte. Außerdem erwarb er „Sport im Bild“ (gegr. 1895) und „Sport im Wort“ (gegr. 1899), 1905 den „Praktischen Wegweiser“ (gegr. 1892; seit 1909 „Allg. Wegweiser“). 1895 gründete er die „August Scherl Dt. Adreßbuch-GmbH“ und erwarb 1905 die 1864 gegründete Frankfurter Anzeigenagentur „G. L. Daube & Comp.“. Mit großem Erfolg erstellte er Adreßbücher für Berlin, Frankfurt/M., Leipzig, Halle, Breslau und Magdeburg. S.s unternehmerische Initiative beschränkte sich nicht auf das Zeitungs- und Verlagswesen. So entwickelte er ein Prämiensparsystem für die Abonnenten seiner Zeitungen, errichtete Ferienhäuser, die seine Angestellten durch die Miete abbezahlen konnten, und propagierte den Bau einer Schnellbahn zwischen Berlin und Hamburg (Ein neues Schnellbahnsystem, 1909). 1914 verkaufte der menschenscheue S., der an einer Kehlkopferkrankung und Depressionen litt, sein Unternehmen an den „Dt. Verlagsverein“ (Düsseldorf), der es zwei Jahre später an den Hugenberg-Konzern weitergab.|",3146,11875470X,1,1,http://www.deutsche-biographie.de/sfz111755.html
"Lotze, Moritz",1809 bis 1890,"L. erhielt Zeichenunterricht in Meißen und studierte dann Malerei und Lithographie an der Kunstakademie in Dresden. Im April 1830 übersiedelte er nach München, wo er als Landschafts- und Tiermaler tätig war. Sein Freund und späterer Schwager Franz Hanfstaengl weckte sein Interesse für die Photographie, die sie im Atelier Alois Löcherers, das sich in Hanfstaengls Haus befand, kennenlernen konnten. Nachdem Hanfstaengl dank seines ausgeprägten Geschäftssinns die Photographie als zukunftsweisend und gewinnbringend erkannt hatte, ließ er 1852 seine Konzession für die Lithographie und Galvanographie ändern in eine solche „zum fabrikmäßigen Betreiben der Vervielfältigung von Kunsterzeugnissen jeder Gattung auf mechanisch-technischem Wege jeder Art“ und eröffnete mit L. im bisherigen Atelier Löcherers ein „Kunstatelier für Photographie“. Bald kam es jedoch zwischen den beiden Partnern zu Spannungen, die sich in den familiären Bereich ausdehnten.L. ging im Herbst 1854 nach Verona und holte, nachdem er sich rasch etabliert hatte, seine drei ältesten Kinder Anna, Emil und Richard zu sich. Er unterrichtete in der Kunst des Photographierens (nach dem Kollodiumverfahren) und wurde ein gesuchter Porträtist. Er machte die Bekanntschaft von Ottavio di Canossa, der ihn in den Kreis der Veroneser Accademia Cignaroli einführte und 1859 Abramo Massalongos „Abhandlung der Paläontologie“ finanzierte, die L. mit 63 Photos illustrierte. Dieses Werk über Tier- und Pflanzenversteinerungen aus dem Umland von Verona gehört wie Theodor Sickels „Monumenta graphica Medii Aevi ex Archiviis et Bibliothecis Imperii Austriaci collecta“ (1858), zu denen L. Photographien von Handschriften aus Verona und Padua beigesteuert hat, zu den ersten wissenschaftlichen Büchern, die Photographien enthalten. Wegweisend in Italien wurde L. indes auf dem Gebiet der Landschafts- und Architekturphotographie. Seine frühen Aufnahmen zeigen eine der traditionellen Genremalerei verbundene Bildauffassung, so die Photos aus Tirol, die auf der Weltausstellung 1867 in Paris mit einer Bronzemedaille ausgezeichnet wurden. L. photographierte die Baudenkmäler sowie die Umgebung von Verona außerordentlich gründlich, so daß eine wertvolle baugeschichtliche Dokumentation entstand. Er löste sein Motiv gleichsam aus dessen räumlicher Umgebung heraus und photographierte es bevorzugt – Tiefe und Größenverhältnisse sinnfällig machend – von einem leicht diagonal versetzten Standort aus. Dank seiner künstlerischen Vorbildung verstand er es, durch Licht und Schatten plastische Wirkung zu erzielen und wichtige Details hervorzuheben. Wahre Meisterschaft erreichte L. in den Photographien der österr. Befestigungsanlagen von Verona, Peschiera, Pastrengo und Ceraino („Festungsviereck“), einem offiziellen Auftrag (1865/66). Die den Motiven angepaßte, graphisch orientierte, noch heute modern anmutende Bildgestaltung entspricht der fortifikatorischen Zweckarchitektur, deren besondere Ästhetik sie – über die exakte Dokumentation hinaus – einzufangen weiß.Nachdem die Österreicher 1866 Verona geräumt hatten, kehrte L. zwei Jahre darauf in seine Wahlheimat München zurück, als Maler und Photograph fortan in bescheidenem Rahmen wirkend. – Sein Sohn Richard führte das Atelier in Verona unter L.s Namen fort, so daß später Photographien des Sohnes fälschlicherweise dem Vater zugeordnet wurden. Hatte sich dieser primär als Maler und Künstler verstanden, so jener als Kunstwissenschaftler, der sich um die systematische Dokumentierung der Werke von Künstlern und der Denkmäler sowohl früherer Epochen als auch der modernen Technik (Kanalanlagen, Fabriken, Maschinen) bemühte.",3642,117230308,1,1,http://www.deutsche-biographie.de/sfz54476.html
