name,date,leben,lengthleben,idn,iplace,ibio,url
Simon I.,1096 bis 1139 oder 1138 ,"S. stand in den Auseinandersetzungen zwischen Kaiser und Papst wie sein Vater auf der Seite der Salier. Seine treue Anhängerschaft zu Lothar von Supplinburg, dem späteren Ks. Lothar III., gründete auf enger Verwandtschaft. Von Lothar wurden S. und der bayer. Hzg. Heinrich der Stolze (um 1108–39) 1132, vor Beginn des Italienzuges, mit dem Schutz des Reiches beauftragt. Der Wahl von Lothars Nachfolger Konrad von Schwaben (März 1138) hielt sich S. fern, betrieb aber keine erkennbare Opposition. Auf dem Gebiet der Territorialpolitik ergaben sich Spannungen aus konkurrierenden Interessen v. a. zu Ebf. Adalbero von Trier und Bf. Stephan von Metz; u. a. wegen des von S. betriebenen Baus der Burg Prény in strategisch wichtiger Lage auf den Höhen links der Mosel auf halbem Weg zwischen Metz und Pontà-Mousson. S.s Verhältnis zu den beiden größten geistlichen Institutionen seines Herrschaftsbereiches, dem Kollegiatstift St-Dié und der Frauenabtei Remiremont, war geprägt durch seine aus der Vogtei abgeleiteten Übergriffe. Sein Vorgehen gegen das Stift StDié trug ihm 1132 eine Exkommunikation durch Ebf. Adalbero von Trier ein, die 1133/34 aufgehoben wurde. Auf Bedrückungen der Abtei Remiremont reagierte Papst Innozenz II. am 17.12.1138 mit Exkommunikation und Verhängung des Interdikts über das Hzgt. Lothringen. Gegenüber anderen Klöstern trat S. als Wohltäter auf: Bekannt sind Schenkungen an die beiden Abteien St. Aper (St-Evre) und St. Mansuetus (St-Mansuy, Toul), an die von seinen Vorfahren gegründete Abtei Hl. Kreuz in Bouzonville/Busendorf (Diözese Metz), die Vogesenabtei St-Sauveur und an die Reformkanoniker von Chaumousey (beide Diözese Toul). Dem jungen Zisterzienserorden gewährte S. Freiheit vom Wegezoll in seinem Herzogtum, er gründete bzw. dotierte die Zisterzen Stürzelbronn und Freistroff (Freisdorf, beide Diözese Metz) und im Zusammenwirken mit seinem Bruder Heinrich, Bf. von Toul, das Prämonstratenserstift Ste-Marie-aux-Bois auf den Höhen westlich der Mosel in der Nähe der Burg Prény. Da zum Zeitpunkt seines Todes die von Papst Innozenz gegen S. verhängten Sanktionen in Lothringen noch nicht bekannt waren, wurde sein Leichnam in der Stiftskirche St-Dié aufgebahrt, nach Eintreffen der Nachricht von seiner Exkommunikation jedoch nach Stürzelbronn gebracht. Ausweislich eines späteren Gedenksteines (nicht Grabsteines) soll er dort am 19.4.1139 beigesetzt worden sein, während eine Urkunde Papst Lucius' II. vom 22.3.1144 St-Dié als Bestattungsort nennt. ",2492,136860877,0,1,http://www.deutsche-biographie.de/sfz56312.html
"Springorum, Fritz",1886 bis 1942,"S. studierte nach dem Besuch des städt. humanist. Gymnasiums in Dortmund an der TH Aachen (1908 Dipl.-Ing., 1910 Dr.-Ing.). In dieser Zeit war er bereits als Assistent im Differdinger Stahlwerk der „Deutsch-Luxemburgischen Bergwerks- und Hütten AG“ tätig und arbeitete 1910/11 als Ingenieur bei der „United States Steel Corporation“ in New York. Danach wurde er Oberingenieur beim mittlerweile zur „Gelsenkirchener Bergwerks-AG“ (GBAG) gehörenden Hüttenwerk des „Aachener Hütten-Aktienvereins“ in Esch an der Alzette (Luxemburg), wo er für den Bau und die Inbetriebnahme des neuen Stahlwerkes verantwortlich war und die Leitung übernahm. 1915 folgte er seinem Vater zur „Hoesch AG“ nach Dortmund, stieg 1917 vom  Betriebsdirektor der Stahl- und Walzwerke zum Hüttendirektor auf, wurde 1920 zum o. Vorstandsmitglied berufen und folgte 1925 seinem Vater als Generaldirektor nach. Zusammen mit seinem Vater trieb S. den Konzernaufbau von Hoesch in den 1920er Jahren voran. Besonders durch den Interessenvertrag mit dem „Köln-Neuessener Bergwerksverein“ (KBV) (1920) bewahrte er die Unabhängigkeit von Hoesch von der „Vereinigte Stahlwerke AG“. Nach der 1930 vollzogenen Fusion mit dem KBV übernahm dessen Vorsitzender →Fritz Winkhaus (1865–1932) den Konzernvorsitz bei Hoesch, nach dessen Tod übernahm S., der in dieser Phase als Stellvertreter von Winkhaus fungiert hatte, wieder den Vorsitz, den er dann 1938 aus gesundheitlichen Gründen aufgab und als Vorsitzender in den Aufsichtsrat wechselte. Als Mitglied der DNVP war S. Dortmunder Stadtverordneter sowie 1933–42  Mitglied des Reichstags und des Reichsverkehrsrats. Er zählte zum „rechten Flügel der Schwerindustrie“ (W. Bührer) und besaß aufgrund seiner Stellung im ruhrindustriellen Verbandswesen großen politischen Einfluß. Zunächst stellv. Vorsitzender des „Vereins zur Wahrung der gemeinsamen wirtschaftlichen Interessen in Rheinland und Westfalen“ („Langnamverein) und der nordwestlichen Gruppe des „Vereins Deutscher Eisen- und Stahlindustrieller“ übernahm er 1930 als Nachfolger von Paul Reusch die Führung beider Verbände und gehörte der sog. „Ruhrlade“ an, einem geheimen Zusammenschluß von zwölf einflußreichen Ruhrindustriellen, die den konservativen bürgerlichen Parteien (seit 1931 auch der NSDAP) jährlich ca. 1,5 Mio. RM spendeten. Seine besondere politische und auch finanzielle Unterstützung galt der Regierung Papen, die, wie er, auf privatwirtschaftliche Strategien zur Lösung der 1929 ausgebrochenen wirtschaftlichen Krise setzte. S. war „keineswegs ein Gegner einer nationalsozialistischen Regierungsbeteiligung“, hielt aber „ungeachtet der Machtübernahme Hitlers an seinem Favoriten Papen fest“ (W. Bührer). NSDAP-Mitglied wurde er 1937. Um die sozialrevolutionären und radikalantisemitischen Strömungen in der NSDAP nicht zu fördern, setzte er sich dafür ein, daß die Gelder der „Ruhrlade“ als persönliche Spenden an Gregor Strasser und Walther Funk gingen. Schließlich erzwang die NSDAP gegen den Widerstand S.s den Rücktritt des Geschäftsführers des Langnamvereins, →Max Schlenker (1883–1967), worauf auch S. 1933 seine Ämter niederlegte und sich auf den „unpolitischen“ Vorsitz im „Verein deutscher Eisenhüttenleute“ zurückzog. ",3209,129966096,0,1,http://www.deutsche-biographie.de/sfz123854.html
"Renneberg, Joachim",1926 bis 1977,"R. wurde nach der Mittleren Reife (1942) Verwaltungslehrling. Im Herbst 1943 zur Wehrmacht eingezogen, war er 1945/46 Angestellter des Polizeipräsidiums Leipzig, dessen Betriebsrat ihn 1946 zum Vorbereitungskurs für das Arbeiterstudium delegierte. 1946 nahm er mit einem Stipendium der Dt. Wirtschaftskommission das Rechtsstudium in Leipzig auf (1. Staatsexamen 1950). In SED, FDGB, FDJ und studentischen Organisationen aktiv, nahm R. 1951 als Aspirant der Juristenfakultät der Univ. Leipzig an einem Dozentenlehrgang an der Dt. Verwaltungsakademie in Forst Zinna teil. 1952 Dozent für Strafrecht an der Univ. Leipzig und 1954 mit der Dissertation „Die kriminalsoziologischen und kriminalbiologischen Lehren und Strafrechtsreformvorschläge Liszt's und die Zerstörung der Gesetzlichkeit im bürgerlichen Strafrecht“ (1956) zum Dr. iur. promoviert, wurde er im selben Jahr als Dozent für Strafrecht an die Dt. Akademie für Staats- und Rechtswissenschaft „Walter Ulbricht“ (DASR) in Potsdam-Babelsberg berufen. Hier war er seit 1956 Professor mit Lehrauftrag (ao. Prof.), 1962/63 Prorektor für die Ausbildung von leitenden Kadern der Justiz, 1955-68  Direktor des Instituts für Strafrecht, seit 1969 o. Professor für Strafrecht am Institut für Strafrechtspflege und Kriminalitätsbekämpfung, 1973-77 stellv. Direktor der Sektion Straf-, Zivil-, Arbeits- und Agrarrecht. Daneben amtierte er als  Leiter der Abteilung Strafrecht des Dt. Instituts für Rechtswissenschaft, als stellv. Vorsitzender des Wissenschaftlichen Rates und als Forschungsbereichsleiter im Institut für Staats- und Rechtswissenschaftliche Forschung. Zudem gehörte er 1956-68 dem Kollegium des Justizministeriums der DDR an und leitete 1957-68 die Grundsatzkommission in der Regierungskommission zur Ausarbeitung des Strafgesetzbuches der DDR von 1968. 1960-65 war er als  Mitglied des Sekretariats der „Internationalen Vereinigung Demokratischer Juristen“ Sekretär einer Untersuchungskommission gegen rechtsextreme Strömungen im Rechtswesen der Bundesrepublik Deutschland. Im Nebenamt war R. als Richter am Kreisgericht Potsdam-Land (1954–57) und im 1. Strafsenat des Obersten Gerichts der DDR (1958–60) tätig.R. war neben John Lekschas (1925–99) der bedeutendste Strafrechtswissenschaftler der DDR in der Ära Ulbricht. Er begründete die auf die sowjet. Strafrechtswissenschaft zurückgehende „Klassenkampftheorie“, nach der jegliches Verbrechen Ausdruck des Klassenkampfes und damit eine Reserve der Konterrevolution sei. Auf der Grundlage dieser Theorie wurden in der DDR-Strafrechtswissenschaft der 50er Jahre alle verbrechensdogmatischen Fragen beantwortet, weshalb sie auch unmittelbar für die repressive stalinistische Strafpolitik dieser Zeit Bedeutung erlangte. Seit 1961 wich die Klassenkampftheorie differenzierteren Verbrechenslehren, die zwischen Straftaten von Staatsverbrechern einerseits und Rechtsbrüchen aus Undiszipliniertheit und Mangel an Verantwortungsbewußtsein andererseits unterschieden. Die Staats- und Parteiführung verpflichtete 1962 die Strafrechtswissenschaftler dazu, ihre bisherigen Positionen von Grund auf zu korrigieren. R. und Lekschas galten fortan als Repräsentanten einer nunmehr als falsch bezeichneten stalinistischen Verbrechenslehre, wenn auch ihre Forschungen zum Schuldbegriff nicht ohne Einfluß auf das spätere Strafgesetzbuch der DDR blieben.|",3352,128483504,1,1,http://www.deutsche-biographie.de/sfz105306.html
"Heyl zu Herrnsheim, Wilhelm Freiherr",1843 bis 1923,"Nach dem frühen Tod des Vaters wurde H. im Haus der Großeltern in Worms erzogen. Dort besuchte er das Gymnasium, dann eine Privatschule in Darmstadt, 1856-58 die Knabenanstalt der Herrnhuter in Neuwied. Längere Auslandsreisen nach England, Frankreich und Italien schlossen den Bildungsgang ab. 1862 übernahm er die Leitung der großväterlichen Lederfabrik. – Die Reichsgründung Bismarcks, für dessen Person und Werk H. zeitlebens große Verehrung empfand, war das entscheidende Erlebnis, das zur Ausbildung seiner politischen Anschauungen beitrug. 1874 wurde er als Kandidat der hessischen Fortschrittspartei (seit 1884 Nationalliberale Partei) in den Reichstag gewählt, dem er bis 1881 und dann wieder 1893-1918 angehörte. 1877 berief ihn Großherzog Ludwig III. in die I. Kammer der hessischen Stände. Neben seiner Tätigkeit als Unternehmer und Politiker widmete er sich seinen künstlerischen Liebhabereien als Sammler und Mäzen. Stets zeigte er große Aufgeschlossenheit für Geschichtsbetrachtung und -forschung.H.s Werke beschäftigten 1913 über 5000 Arbeiter und Angestellte. Vor allem galt sein Wirken der Erweiterung und Modernisierung der Fabrikation. Er führte Maschinen, Elektrizität sowie chemische Gerbung ein. Stetig förderte er die vom Großvater übernommene sozialpolitische Fürsorge und kümmerte sich um eine großzügige Wohnungs- und Siedlungspolitik, die eine dem heimischen Boden verbundene Arbeiterschicht schaffen sollte. Dafür blieben dem Werk unter seiner mehr als 50jährigen Führung sozialpolitische Machtkämpfe erspart. – Seit dem Bruch Bismarcks mit den Nationalliberalen trieb H. konservative und betont nationale Politik. Maßgebend war er an der Vorbereitung und Durchsetzung des Heidelberger Programms (1884) beteiligt. Im Reichstag wie in der I. hessischen Kammer hat er sich vorwiegend mit sozial- und wirtschaftspolitischen Fragen beschäftigt (Arbeiterschutz; Rheinregulierung, Handels-, Eisenbahn-, Steuerpolitik). Sein sozialpolitisches Wirken, das nicht frei von einer zeitbedingten staatsautoritären Auffassung war, fand überall dort Grenzen, wo die sozialdemokratische Bewegung durch eine Maßnahme begünstigt werden konnte; ihre Bekämpfung blieb sein zentrales Anliegen. – Da nach seiner Meinung eine gesunde Volkswirtschaft nur bei gleichmäßiger Förderung von Industrie und Landwirtschaft gedeihen konnte, bekämpfte er als Großindustrieller die unter Caprivi abgeschlossenen Handelsverträge und trat für die von der Landwirtschaft geforderten Schutzzölle ein. – Seine spätere parlamentarische Tätigkeit wurde vergällt durch den unaufhaltsamen Zerfall der nationalliberalen Partei. Seit der Reichsfinanzreform war zwischen der konservativen Richtung der „Wormser Ecke“ und dem Linkskurs, den der Parteiführer Bassermann nach dem Scheitern des Bülowblockes einschlug, keine Verständigung mehr möglich. H.s Austritt aus der Fraktion (1909) beendete sein parlamentarisches Wirken im Reichstag; in der I. hessischen Kammer dagegen wuchs er im letzten Jahrzehnt vor Kriegsausbruch in eine unumstrittene Führerstellung hinein. Der Untergang der Monarchie setzte seiner politischen Tätigkeit ein Ende.|",3125,118704516,1,1,http://www.deutsche-biographie.de/sfz32142.html
"Jörs, Paul",1856 bis 1925,"Seit 1876 studierte J. in Bonn zuerst Geschichte, dann, ohne seine historischen und philologischen Interessen aufzugeben, Rechtswissenschaft. Nach 4 Semestern in Leipzig (1877–79) wieder in Bonn, bestand er 1880 das Referendarexamen und wurde 1882 aufgrund seiner Dissertation „Über das Verhältnis d. Lex Iulia de maritandis ordinibus z. Lex Papia Poppaea“ promoviert. Noch im selben Jahr erwarb er mit einer in ihrer damaligen Gestalt unveröffentlicht gebliebenen Abhandlung über die Geschichte der augusteischen Ehegesetzgebung in Bonn die venia legendi für Röm. Recht. 1886 berief ihn Althoff als Ordinarius nach Kiel. 1888-96 lehrte er in Gießen (1892 Rektor), danach bis 1905 in Breslau und anschließend in Wien. Besondere Förderung erfuhr J. durch R. Stintzing, C. v. Noorden, K. H. Usener und F. Bücheler. Mit Ed. Schwartz war er seit seiner Bonner Studienzeit befreundet. Diese Namen kennzeichnen die Richtung seiner wissenschaftlichen Arbeit. Ihn interessierte nicht so sehr die Dogmatik des Röm. Privatrechts, obwohl er auch sie mit großer Sicherheit beherrschte. Der Schwerpunkt seiner Studien lag vielmehr im historischen Teilbereich seines Faches. Schon die mit seiner Dissertation beginnenden Untersuchungen über die augusteische Ehegesetzgebung, die mit seinem Beitrag zu der Gießener Festschrift für Theodor Mommsen (1894) ihren Abschluß fanden, sind einem Gegenstand von spezifisch geschichtlicher Bedeutung gewidmet, dem ersten umfassenderen Versuch sozialpolitischer Reformgesetzgebung. Für|seine Gießener Rektoratsrede wählte sich J. ein rein historisches Thema: Die Reichspolitik Kaiser Justinians (1893), und auch die 1892 in der Gießener Festgabe für R. v. Ihering erschienenen „Untersuchungen zur Gerichtsverfassung der röm. Kaiserzeit“, die sich vor allem mit der Entwicklung des Beamtenrichtertums befassen und zu einem erheblichen Teil auf inschriftlichen Quellen beruhen, gehören dem Grenzbereich zwischen Geschichte und Rechtsgeschichte an. Eine J. noch in seinen letzten Lebensjahren beschäftigende Studie über den Prinzipat des Augustus blieb unvollendet.Nahe bei diesen der Rechtsgeschichte und allgemeinen Geschichte der Kaiserzeit zugewendeten Arbeiten stehen J.s Beiträge zur Geschichte der röm. Jurisprudenz und der röm. Rechtsquellen. Schon 1888 erschien der 1., nur „bis auf die Catonen“ reichende Band einer „Rechtswissenschaft der röm. Republik“, der nicht zu Unrecht den Anlaß zu seiner raschen akademischen Karriere gebildet und die Vorstellungen über die Anfänge der röm. Jurisprudenz lange Zeit in weitem Maße bestimmt hat. Die Kargheit der juristischen Überlieferung ist in diesem mit jugendlicher Zuversicht geschriebenen Buch durch eine breite historische Fundierung bis zu einem gewissen Grad wettgemacht. J. hat das Werk nicht fortgesetzt, vielleicht, weil er sich in der Folgezeit mehr und mehr der Schwierigkeiten des Gegenstands bewußt wurde. Er hat aber durch nicht weniger als 55 mitunter sehr umfängliche Artikel über röm. Juristen und Rechtsquellen, die er in seiner Breslauer Zeit für die Realenzyklopädie der klassischen Altertumswissenschaft schrieb, die juristische Literaturgeschichte, vornehmlich der Kaiserzeit, wesentlich gefördert. In die Breslauer Jahre reichen auch seine papyrologischen Studien zurück, aus denen zwei Abhandlungen erwachsen sind. Die erste (ZSRG 34, 1913, S. 107 ff.) behandelt die Verfahren der Demosiosis und der Ekmartyresis, durch die im kaiserzeitlichen Ägypten rein private Geschäftsurkunden nachträglich mit der Kraft notarieller Urkunden ausgestattet werden konnten. Die 2. Abhandlung (ebd. 36, 39 u. 40, 1915-19) versucht unter dem Titel „Erzrichter und Chrematisten“ vor allem das Mahn- und Vollstreckungsverfahren aus den Papyri der röm. Periode zu rekonstruieren. Beide Abhandlungen sind für die in ihnen behandelten speziellen Probleme des röm.-ägypt. Rechtswesens grundlegend geblieben.1901 hatte J. im Rahmen der Birkmeyerschen Enzyklopädie der Rechtswissenschaft einen knappen Abriß des röm. Privatrechts erscheinen lassen. In seinen letzten Lebensjahren baute er diese ältere Arbeit zu einer ausführlicheren Darstellung von „Quellen und System des Röm. Rechts“ (1928) für die nun von Kaskel und Kohlrausch herausgegebene Enzyklopädie der Rechts- und Staatswissenschaft aus. Der seit Jahren schwer leidende J. war nicht mehr imstande, die während des 1. Weltkriegs und danach erschienene und damals nur z. T. schon zugängliche ausländische Literatur selbst einzuarbeiten. Das in seiner knappen Klarheit vorzügliche Werk mußte darum in einer 2., 1936 erschienenen Auflage weitgehend umgearbeitet werden.|",4604,117150312,1,1,http://www.deutsche-biographie.de/sfz37365.html
"Hörlein, Heinrich",1882 bis 1954,"H. begann sein Chemiestudium 1900 an der TH Darmstadt. 1902 siedelte er zu L. Knorr nach Jena über und bestand 1903 in den Fächern Chemie, Physik und Nationalökonomie sein Doktorexamen. Während seines Studiums hatte er zeitweise in der Zuckerfabrik Groß-Gerau gearbeitet. Knorr und H., seit 1904 dessen Privatassistent, lieferten wertvolle Beiträge zur Konstitutionsermittlung des Morphins und stellten eine mehr als 15 Jahre lang gültige Formel auf, die, wie J. M. Gulland und R. Robinson erkannten, nur geringfügiger Änderungen bedurfte. In die Jenaer Zeit fiel – von P. Rabe experimentell bestätigt – auch H.s intuitive Vorausschau der letzten strukturellen Einzelheiten des Chinins und seiner Derivate. Aus Anlaß der Morphinarbeiten war H. 1906-08 auswärtiger Mitarbeiter der Firma Boehringer und Söhne, Mannheim, geworden, folgte aber 1909 einem Angebot C. Duisbergs an die Farbenfabriken vormals Fr. Bayer und Co. nach Elberfeld.H.s erste Elberfelder Erfolge lagen auf dem Farbstoffgebiet. Unter seinen mannigfachen pharmazeutisch-chemischen Arbeiten ragte die Erfindung des weltbekannten Schlafmittels und Antiepileptikums Luminal hervor. Der bedeutendste Teil seines Lebenswerkes begann jedoch, als er schrittweise immer größere organisatorische Aufgaben innerhalb der Farbenfabriken vormals Fr. Bayer und Co. und später innerhalb der 1925 gegründeten I. G. Farbenindustrie AG übernahm. Das Werk Elberfeld baute er zielbewußt zu einer umfassenden chemisch-medizinischen Forschungsstätte aus und schuf dadurch die Voraussetzung für eine weitgehend selbständige Forschungsarbeit der Chemiker und Mediziner des Werkes, eine Arbeit, die insbesondere auf dem Gebiet der Chemotherapie zu überragenden Erfolgen führte: Ergebnisse dieser Jahre waren unter vielen anderen neben Neuentwicklungen auf dem Gebiet der Schlafmittel und Narkotika Evipan (W. Kropp, L. Taub, H. Weese) und Phanodorm (W. Schulemann, K. Meisenburg), das Blutersatzmittel Periston (Weese), insbesondere Entdeckung und Entwicklung der berühmten Malariamittel Plasmochin (W. Schulemann, F. Schönhöfer, A. Wingler, W. Röhl, W. Kikuth), Atebrin (F. Mietzsch, H. Mauss, W. Kikuth) und Resochin (H. Andersag, St. Breitner, H. Jung, W. Kikuth), das Piroplasmosemittel Acaprin (H. Henecka, F. Schönhöfer, W. Kikuth), die Antimonpräparate Neostibosan und Solustibosan (F. Schmidt) gegen Kala Azar, die Entdeckung der antibakteriell wirksamen Sulfonamide (F. Mietzsch, J. Klarer und G. Domagk), die Synthese des Vitamin B1 (H. Andersag und K. Westphal) und das Tuberkulostatikum Conteben (R. Behnisch, F. Mietzsch, G. Domagk), an das sich später das hochwirksame Neoteben (H. A. Offe, W. Siefken, G. Domagk) anschloß.1931 wurde H. Vorstandsmitglied und 1933 Vertreter der Pharmasparte im Zentralausschuß der I. G. Farbenindustrie AG. In der Folgezeit hatte er erhebliche Widerstände zu überwinden, um die für die pharmazeutische Forschung entscheidend wichtigen Tierversuche zu gewährleisten. – Das Ende des 2. Weltkrieges brachte 1945 die Auflösung der I. G. Farbenindustrie AG mit sich. Gegen H. und 23 seiner Kollegen wurden im I. G. Farben-Prozeß in Nürnberg Anklagen erhoben, die zwar den objektiven Kennern der Dinge abwegig erschienen, damals aber doch als lebensbedrohlich betrachtet werden mußten. Der Prozeß endete nach über einjähriger Dauer 1948 mit H.s Freispruch. 1952 wurde H. zum Aufsichtsratsvorsitzenden der neu gegründeten Farbenfabriken Bayer berufen.|",3434,116932228,1,1,http://www.deutsche-biographie.de/sfz32909.html
"Much, Matthäus",1832 bis 1909,"Nach der Matura 1851 am Theresianum studierte M. in Wien Jus, wobei sich seine Interessen gleichzeitig auch auf die Altgermanistik und die Naturwissenschaften richteten. Unter anderem hörte er Vorlesungen von Friedrich Simony, der 1850 über Funde aus Hallstatt publiziert hatte. Zunächst ging M. als Finanzbeamter nach Temesvár, 1858 promovierte er in Graz zum Doktor der Rechte und übernahm nach seiner Eheschließung die Leitung der Zitherfabrik seines Schwiegervaters in Wien. Die Sammelleidenschaft des seither finanziell unabhängigen M. führte in den 70er Jahren zu umfangreichen Grabungen. So entdeckte er 1874 am Mondsee, wo er ein Haus besaß, eine Pfahlbausiedlung und ließ diese freilegen. Er öffnete hallstättische Tumuli und führte Testschnitte in zahlreichen Wehranlagen Niederösterreichs durch. 1877 wandte er sich dem alpinen Kupferbergbau zu und publizierte die von Johann Rudolf Pirchl entdeckten Funde vom Mitterberg. In Kommission verkaufte M. für den dän. Altertumshändler Henriquez prähistorische Funde. 1877 wurde M. aufgrund seiner umfangreichen Grabungsaktivitäten zum  Mitglied der k. k. Zentralkommission zur Erforschung und Erhaltung der Kunst- und der historischen Denkmale ernannt, wo er in der Sektion für prähistorische Funde und antike Kunst sowie im Komitee für Denkmalschutzgesetzgebung wirkte. Seine Hauptverdienste liegen in der Feldforschung. Dagegen erschienen viele seiner Interpretationen, besonders der Tumuli und Wehranlagen, bereits seinen Zeitgenossen germanophil. M. führte den Terminus „Kupferzeit“ in Österreich ein. Einige seiner Ideen waren richtungweisend: die Gründung eines niederösterr. Landesmuseums, der gesetzliche Schutz für Bodendenkmale und die Information über diese sowie über Prähistorie bereits in den Schulen. Durch seine Paläolithforschungen sowie die sorgsame Aufbewahrung auch von organischen Fundresten wird sein Interesse für die Umwelt des prähistorischen Menschen deutlich. Sein Vorschlag eines „Staatl. Untersuchungsamtes in physikalisch-chemischer Richtung“ (1892) zur Analyse von Bodenfunden blieb unerfüllt. Von bleibendem Wert ist seine Sammlung; sie bildet seit 1912 den Grundstock der Studiensammlung des heutigen Instituts für Ur- und Frühgeschichte der Univ. Wien. Galt er lange als „Nestor der Urgeschichte Österreichs“, wird M. heute eher nüchterner betrachtet: Er war Autodidakt und fand – persönlich wie in seinen Theorien – kaum Aufnahme in akademische Kreise. Doch dank seines immensen Fleißes entdeckte er zahlreiche prähistorische Fundstätten und beschrieb viele von diesen erstmals.|",2570,119554518,1,1,http://www.deutsche-biographie.de/sfz65896.html
