name,date,leben,lengthleben,idn,iplace,ibio,url
"Deichmann, Wilhelm Ludwig",1798 bis 1876,"D. - drittes von 8 Kindern - meldete sich 15jährig freiwillig als Freiheitskämpfer, nahm 1815 eine kaufmännische Lehre in Bremen an und trat 1818 in das damals bedeutendste Kölner Bankhaus von Abraham Schaaffhausen ein. Hier stieg er schnell empor. 1830 übernahm er die Gesamtleitung des Hauses; als es 1848 zur ersten privaten deutschen Aktienbank umgewandelt wurde, erhielt er neben G. von Mevissen und V. Wendelstadt die Mitdirektion des nunmehrigen A. Schaaffhausenschen Bankvereins. Der Bankverein wurde unter dieser Leitung zum führenden Finanzinstitut Nordwestdeutschlands. 1858 trat D. freiwillig aus und gründete zusammen mit Adolph vom Rath ein eigenes Bankhaus in Köln: Deichmann & Co. D.s außerordentliche Kenntnisse der westdeutschen Wirtschaft und sein liebenswürdiges Wesen schufen die freundschaftlichen und verwandtschaftlichen Verbindungen zu den großen Handelsherren und Industriellen Nordwestdeutschlands in der Aufstiegszeit. Innerhalb des Handels- und Bankhauses A. Schaaffhausen betätigte er sich erfolgreich, um den Warenhandel und das Speditionsgeschäft einzuschränken und desto stärker das reine Bankgeschäft aufzubauen. So wurde er der eigentliche Träger des merkantilen und industriellen Aufschwungs, den Köln und die westdeutsche Wirtschaft nahmen.D. war an fast allen führenden Unternehmungen der westdeutschen Schwer-, Eisen- und Maschinenindustrie an Rhein, Ruhr, Wurm-Inde, Lahn und Sieg maßgeblich als Initiator und Vertrauensmann beteiligt: Stumm, Saargebiet; Peuchen, Hoech und Poensgen, Eifel; Hüttengewerkschaft von Handlung Jacobi, Haniel und Huyssen (Gutehoffnungshütte); Dinnendahl (Friedrich Wilhelmhütte); H. Diedr. Piepenstock (Hörder Verein); van der Zypen & Charlier, Deutz und andere. Er war der maßgebende Finanzmann für die Ruhrzechen „Helene und Amalie“, Altenessen, Neuköln und Anna. Allen Stinnes-Unternehmen stand er als Bankier ebenfalls zur Seite, ferner den Unternehmen Krupp, Henschel & Sohn, Harkort, Märkisch-Westfälischer Verein, Bochumer Verein, Köln-Müsener Bergwerksverein und vielen anderen mehr. Ebenso hatte er als Finanzier starken Anteil an der rheinischen Textil- und Zuckerindustrie sowie am Roheisenhandel (Gebrüder Hoesch, Düren; R. Poensgen, Schleiden) und am Kölner Öl-, Häute- und Lederhandel, deren moderne Entwicklung er entweder ins Leben rief oder deren Ausbau im technisch großkapitalistischen Sinne von ihm stärkstens gefördert wurde. Sowohl zur Zeit der Personalunternehmungen als auch der von ihm nachdrücklich betriebenen Gründungen und Umgestaltungen von Aktienunternehmungen war D. der führende Kopf in der damals für den Westen bestimmenden Bankmetropole Köln. Zum Schwerpunkt seiner Tätigkeit als Bankier machte er das Bankgeschäft mit seinen beiden Zweigen der laufenden Kreditgewährung an Handel und Industrie, die er fast ausschließlich auf die Pflege des persönlichen Kontokorrentgeschäfts ohne hypothekarische Sicherstellung ausrichtete, sowie des industriellen Gründungs- und Emissionsgeschäfts. D. wurde so der Berater und Mittler zwischen Industrie und Rentenkapital Westdeutschlands, mit deren führenden Männern er stets in engstem Kontakt war, unter anderem war Alfred Krupp nach 1858 sein wichtigster Bankkunde und persönlicher Freund. D. war wohl der markanteste Vertreter der „neuen Generation von idealistischen Realisten“, die von Köln aus im 19. Jahrhundert die Wirtschaft Westdeutschlands aufbauten. Preußischer GKR.",3421,138678707,1,1,http://www.deutsche-biographie.de/sfz68263.html
"Kaempf, Johannes",1842 bis 1918,"Nach einer kaufmännischen Lehre in einem Tuch-Engrosgeschäft in Brandenburg/Havel setzte K. seine Ausbildung als Handlungsgehilfe bei einer kleinen Berliner Bank fort, um dann in einem größeren Geldinstitut u. a. als Prokurist tätig zu sein. 1867 war er bereits in Berliner Bankkreisen derart angesehen, daß er auf Empfehlung und Vermittlung des Präsidenten der Preuß. Bank Hermann F. A. Dechend als Direktor und persönlich haftender Gesellschafter in Halle a. d. Saale das Bankhaus „Hallescher Bankverein Kulisch, Kaempf & Co.“ gründen und zu großem geschäftlichem Erfolg führen konnte. Schon 1871 kehrte K. nach Berlin zurück, wo er als  Direktor der Berliner Niederlassung der „Bank für Handel und Industrie“ (Darmstädter Bank) zusammen mit den Vorstandsmitgliedern Richard Michelet und Jacob Riesser das Berliner Bankleben entscheidend prägte. Eine schwere Augenkrankheit zwang K. 1899 zur Aufgabe des Direktionspostens. Von seinen zahlreichen Vorstands- und Aufsichtsratsfunktionen seien genannt: Vorsitz im Börsenvorstand (1888–1902), im Gesamtbörsenvorstand (bis 1918), stellvertretender Deputierter im Zentralausschuß der Reichsbank (seit 1901), stellvertretender Präsident der Berliner Hypothekenbank (seit 1907), stellvertretender Vorsitzender (seit 1901) und Präsident (seit 1905) des Deutschen Handelstages. Auf dem Höhepunkt seiner kaufmännischen und politischen Laufbahn verfügte der 70jährige über ein Vermögen von 5,1 Millionen Mark bei einem jährlichen Einkommen von 30 000 Mark. – Hervorhebung verdient seine Tätigkeit in der Korporation der Kaufmannschaft von Berlin, in die er 1878 eintrat, in der er 1882  Mitglied des Ältesten-Kollegiums, 1889 zweiter, 1895 erster Vizepräsident wurde und 1903-18 Präsident war. Mit Erfolg hat sich K. zusammen mit den Vizepräsidenten Max Weigert und Edmund Helfft gegen die beabsichtigte Umwandlung der Korporation in eine Handelskammer gewehrt. Dieses Dreiergremium wußte sich gegen die 1902 gegründete Handelskammer zu Berlin so gut zu behaupten, daß erst kurz vor K.s Tode erneut die Verhandlungen um die dann am 1.7.1920 vollzogene Zusammenlegung von Korporation und Handelskammer begannen. In diese eigenständige Phase der Korporation fallen die Errichtung einer Handelshochschule in Berlin (1906) mit einer „Kaempf-Maas-Stiftung“ (1909) für Studienreisen, der Erweiterungsbau „Haus Johannes Kaempf“ des Asylhauses für hilfsbedürftige Kaufleute und die Herausgabe des „Berliner Jahrbuchs für Handel und Industrie“.K. war nicht nur im Bankleben erfolgreich, sondern als Reichstagsabgeordneter und Mitbegründer des Hansabundes (1909) auch politisch aktiv und einflußreich. 1886-99 war er  Mitglied des Magistrats der Stadt Berlin (seit 1890 Stadtrat, seit 1901  Mitglied der Stadtverordnetenversammlung und Stadtältester). Zu den Reichstagswahlen seit 1903 wurde er als Kandidat der Freisinnigen Volkspartei nominiert und konnte den Wahlkreis 1 (Innenstadt) der Stadt Berlin in den Stichwahlen gegen den Sozialdemokraten Dr. Arons gewinnen. Als Fraktionsvorsitzender der Freisinnigen Volkspartei sowie 1907-09 als 2. Vizepräsident und seit 1912 als Präsident des Deutschen Reichstages zeigte K. in zahlreichen Reden und Anträgen ein breites wirtschafts-, vor allem handels- und finanzpolitisches, aber auch kommunal- und sozialpolitisches Wissen und freisinniges Engagement.|",3334,116013710,1,1,http://www.deutsche-biographie.de/sfz38230.html
"Koreff, David Ferdinand",1783 bis 1851,"K. nahm 1802 das Medizinstudium in Halle auf. Er schloß sich der unter Schellings Einfluß herrschenden „naturphilosophischen Medizin“ an und wandte sich besonders den Ideen Franz von Baaders und dem Heilverfahren des Magnetismus zu. 1803 kam K. zur klinischen Ausbildung nach Berlin, wo er bald Anschluß an einen enthusiastischen frühromantischen Kreis um K. A. Varnhagen von Ense und A. von Chamisso, den Nordsternbund, fand. Nach Abschluß seines Studiums in Halle praktizierte K. in Paris und erwarb rasch gesellschaftliche Beliebtheit in einer vorwiegend eleganten Klientel in den Gesandtschaften und der deutschen Kolonie, damals einem Zentrum der romantischen|Bewegung. Unbefriedigt vom ärztlichen Alltag, arbeitete er an zahlreichen literarischen Projekten, ohne ein wesentliches zu vollenden. 1811-13 hielt er sich mit der Marquise D. de Custine auf Reisen in Italien und der Schweiz auf. Ende 1813 fand er sich in Wien ein, wo sein ehrgeiziges Streben nach politischem Einfluß, einer gesellschaftlich glanzvollen Rolle und einer Anstellung als Arzt bei den Armeen erfolglos blieb. Doch gewann er die Zuneigung Caroline von Humboldts, über deren Einfluß er 1815 rasch in den engsten Kreis um den für den Magnetismus eingenommenen preußischen Staatskanzler Fürst von Hardenberg gelangte. Als Leibarzt begleitete er diesen auf Reisen, wurde 1818 Geheimer Oberregierungsrat und gewann großen politischen Einfluß. Er genoß diese Position auf dem Kongreß in Aachen 1818 und verhalf der „naturphilosophischen Medizin“ anläßlich der Universitätsgründung Bonn zu einer starken Stellung – gegen den Widerstand der Berliner medizinischen Fakultät, der er 1816 als Professor aufgedrängt worden war. Von K.s Freundschaften dieser Jahre sind die mit Rahel Varnhagen und E. T. A. Hoffmann hervorzuheben, in dessen „Serapionsbrüdern“ K. als Vinzenz fortlebt. K.s Sturz durch ein Intrigenspiel 1822 fällt zusammen mit dem beginnenden Stimmungsumschwung gegen den Magnetismus. In Paris gelang ihm nochmals eine glanzvolle Karriere. Bald hatte er an den Gesandtschaften eine einträgliche Praxis, wobei er neben magnetischen Kuren auch andere gängige und modische Heilverfahren anwandte. Er verkehrte in den exklusiven konservativen Salons ebenso wie als Freund Benjamin Constants in den liberalen Zirkeln. Heine ließ sich von K. behandeln und befreundete sich mit ihm. K. gehörte den Abendgesellschaften um Stendhal, Mérimée, Musset und Delacroix an und war über Jahre der Arzt der berühmten Marie Duplessis, nach der Dumas’ „Kameliendame“ entstand. Als Vermittler deutscher Literatur hat er besonders E. T. A. Hoffmann in Frankreich bekannt gemacht. Ein Skandal um überhöhte Honorarforderungen beendete schlagartig seine Karriere in der eleganten Welt. Nach 1838 fand er in der Pariser Mittelschicht seinen letzten Wirkungskreis.K., mehr blendende Erscheinung als schöpferische Persönlichkeit, gehörte zu den interessantesten „romantischen Ärzten“. Von seinen wenigen wissenschaftlichen und literarischen Veröffentlichungen erreicht keine besonderen Rang. Als einer der begabtesten aber auch unkritischsten Magnetiseure verkannte er die Grenzen der Suggestivkräfte – sein späterer Ruf als Scharlatan trifft ihn nicht unverschuldet. Im Gespräch war er liebenswürdig, brillant, geistreich, fesselnd und weckte leicht unerfüllbare Erwartungen. Eine besondere Position unter den Frühromantikern gewinnt er durch seine lebenslang ausgetragene Spannung zwischen vielseitiger Begabung und Maßlosigkeit seiner Ansprüche, die ihn in wiederholte Existenzkrisen führte. Als Vermittler bewirkte er die für die Romantik so charakteristische „Ideenansteckung“.",3636,118777831,1,1,http://www.deutsche-biographie.de/sfz44542.html
"Kümpers, Karl",1808 bis 1886,"Nach dem Tode der Eltern wurde K. in die Obhut seines Onkels B. Th. Sträter, Tuchhändler in Rheine und Amsterdam, gegeben und kam mit 18 Jahren zur Ausbildung in die Firma Peter Drießen & Sohn, Baumwoll- und Garnhandel in Bocholt und Fabrikation von Leinen und Baumwollgeweben in Aalten (Niederlande). Im Sept. 1834 beschlossen K., der selbst kein Vermögen besaß, und der aus Zwolle stammende vermögende Jurist Joh. Friedrich Timmerman (1802–78), eine „Fabrik zur Verfertigung von Leinen und Baumwoll-Waaren“ einzurichten. Die als Hausweberei betriebene Firma C. Kümpers & Timmerman wurde von K. allein geführt. Anfangs noch Leinengarn weiterverarbeitend, war die Firma in Rheine die erste, die besonders seit 1837 – nach Einströmen billiger engl. Baumwollgarne nach Preußen – größere Mengen Baumwolle auf Handwebstühlen in der Umgebung verweben ließ. Zunächst nur mit Lagerung, Verwaltung und Handel beschäftigt, errichteten die Teilhaber 1836 ein Fabrikgebäude. In diesem ersten Betrieb der Baumwollindustrie in Rheine wurden zur Rationalisierung der Handweberei eine Kettgarn-Stärkemaschine mit Hilfsgeräten und einige Jahre später elf Handwebstühle aufgestellt. 1845 wurde K. Teilhaber und Direktor der offenen Handelsgesellschaft „Baumwoll-Spinnerei“, der ersten vollmechanischen Spinnerei Westfalens mit 8 000 Mule- und 2 000 Trosselspindeln.Die Mechanisierung mußte auf die Weberei übergreifen, was zur Folge hatte, daß bei Kümpers & Timmerman 1849 zwei „Powerlooms“ aufgestellt wurden, die ersten mechanischen Webstühle im Regierungsbezirk Münster. 1857 errichteten K. und Timmerman eine größere mechanische Weberei außerhalb der Stadt Rheine. 1861 werden für „C. Kümpers & Timmerman, Maschinen-Weberei für baumwollene Zeuge“ zwei Direktoren, 176 männliche, 40 weibliche Arbeiter und 399 mechanische Webstühle angegeben. 1858 brannte die Baumwollspinnerei ab. Ein Versicherungsformfehler führte zu Unterdeckung des Schadens. K. legte daraufhin sein Direktorenamt nieder. Die Erhöhung der Baumwollpreise infolge des amerikan. Bürgerkrieges (1861–65) und das Baumwollwarenangebot aus dem nach 1871 angeschlossenen Elsaß brachten Absatzschwierigkeiten. K. und Timmerman konnten die Notjahre nur mit Hilfe eines Personalkredits des Bankhauses von der Heydt-Kersten & Söhne, Wuppertal-Elberfeld, durchstehen.In der günstigeren Zwischenphase errichteten die beiden Teilhaber 1866 eine neue mechanische Baumwoll-Spinnerei für 16 000 Spindeln, betrieben mit Hilfe einer 50-PS-Doppel-Zylinder-Dampfmaschine. 1879 gründete K. für seine Söhne Hermann und Alfred unter dem Namen C. Kümpers Söhne eine Nesselweberei, seit 1884 mit Spinnerei, die diese 33 Jahre lang gemeinsam führten. 1912 erfolgte die Teilung, wobei Hermann den Betrieb Walshagen als Firma Spinnerei und Weberei Hermann Kümpers übernahm, während Alfred und seine Nachkommen die Spinnerei und Weberei C. Kümpers Söhne bis heute fortsetzten. Der|älteste Sohn Franz August, zunächst Prokurist und seit 1870 wie sein Bruder Carl jun. Teilhaber der Baumwollspinnerei und -weberei C. Kümpers & Timmerman, löste sich 1886 aus dem väterlichen Unternehmen und übernahm die von seinem Vetter Everhard Kümpers in seinem Auftrag gegründete Firma F. A. Kümpers in Rheine, in der später sein Sohn August tätig war. Die Ursprungsfirma Kümpers & Tiedeman wurde von Carl jun., dann über 50 Jahre lang von dessen Sohn Carl Godfried unter Mitwirkung der Nachkommen Timmermans geleitet. Zur Zeit arbeiten in Rheine in den Firmen C. Kümpers & Söhne, F. A. Kümpers KG und Hermann Kümpers GmbH & Co. noch Nachkommen K.s. Den Firmen- und Familienzusammenhalt förderte seit 1894 die Carl Kümpers'sche Familienstiftung.Da der Anteil von Timmerman an den Gründungen hauptsächlich finanzieller Art war, wird K. als Begründer der Nesselweberei, Dampfmaschinenspinnerei und Maschinenweberei im Kreis Steinfurt angesehen. Als Liberaler war er jahrzehntelang Stadtverordneter in Rheine, Vertreter der Kaufmannschaft bei Verhandlungen für den Bau des Eisenbahnknotenpunktes Rheine,  Mitglied der Armen-Commission, des Handelskammer-Kollegiums (seit 1854) für die Errichtung der Handelskammer Münster. K. wirkte mit bei Kommissionen für die Weltausstellungen in Paris und London|.",4209,136588417,1,1,http://www.deutsche-biographie.de/sfz46722.html
"Plettner, Bernhard",1914 bis 1997,"Nach dem Besuch des humanistischen Gymnasiums in Bad Kreuznach studierte P. an der TH Darmstadt Elektrotechnik. Als Diplom-Ingenieur trat er 1940 in die „Siemens-Schuckertwerke AG“ in Berlin ein, wo er zunächst in der Projektierung und Planung sowie im Vertrieb von Anlagen der Industrie und Energieversorgung im In- und Ausland tätig war. 1949 wurde er  stellvertretender Leiter der Exportabteilung und in dieser Eigenschaft schwerpunktmäßig für das Überseegeschäft verantwortlich, seit 1955 leitete er die Projektierungsabteilungen für die Grundstoffindustrie. 1959 wurde P.  Vorstandsmitglied der Siemens-Schuckertwerke, 1961 stellvertretender Vorstandsvorsitzender und 1962 Vorstandsvorsitzender. Bei der Zusammenführung der drei Siemens-Stammfinnen „Siemens & Halske“, „Siemens-Schuckertwerke“ und „Siemens-Reiniger-Werke“ in die „Siemens AG“ 1966 rückte P. in das dreiköpfige Vorstandspräsidium auf. 1968 trat er als stellvertretender Vorsitzender an die Seite des Siemens-Vorstandschefs →Gerd Tacke (1906–97); nach dessen Ausscheiden 1971 wurde P. Vorstandsvorsitzender der „Siemens AG“.P., der als nüchtern-rationell denkender Pragmatiker und strategischer Planer galt, leitete wegweisende Entwicklungen bei Siemens ein. Die Verstärkung der internationalen Aktivitäten und der beschleunigte Ausbau der Position von Siemens auf dem amerik. Elektromarkt, z. B. durch die Kooperation mit „Allis-Chalmers“ und den Aufbau von „Siemens Corporation“ mit Sitz in Iselin (New Jersey) zählen zu seinen größten Verdiensten. Technische Spitzenleistungen und Innovationen trieb er vor allem in der Mikroelektronik und Datenverarbeitung sowie in der Reaktortechnik voran. Den Bereich Energieerzeugung, eines der Kernarbeitsgebiete von Siemens, stärkte er insbesondere durch die 1969 gemeinsam mit der AEG gegründeten Tochtergesellschaften „Kraftwerk Union AG“ (KWU) und „Transformatoren Union AG“ (TU), die später von Siemens übernommen wurden. 1975 übernahm Siemens die Mehrheit der angeschlagenen Siemens-Beteiligungsgesellschaft „Osram GmbH“, die sich seit 1976 unter der Leitung von P.s Bruder Helmut rasch erholte und 1978 in den Alleinbesitz von Siemens überging. Seine Zeit als Vorstandsvorsitzender war durch streng ertragsorientiertes Management und striktes Kostendenken gekennzeichnet. Nach seinem Ausscheiden als Vorstandsvorsitzender 1981 wurde P. als Nachfolger von →Peter v. Siemens (1911–86) zum Aufsichtsratsvorsitzenden der „Siemens AG“ gewählt. Da diese einfluß-reiche Position bis dahin traditionell von einem  Mitglied der Siemens-Gründerfamilie gehalten wurde, war P. der erste Nicht-Familienangehörige in diesem Amt. 1988 schied er aus Altersgründen aus dieser Position aus.|",2692,128693290,1,1,http://www.deutsche-biographie.de/sfz96367.html
"Schörner, Ferdinand",1892 bis 1973,"S. diente nach dem Abitur 1911 ein Jahr als Freiwilliger in der Bayer. Armee und studierte dann in München Philosophie und Romanistik. Studienaufenthalte in Lausanne, Grenoble und Italien folgten. Im Aug. 1914 zog er in den Krieg und bewährte sich an wechselnden Fronten (1914 Lt., 1918 Oberlt.). Im April 1919 trat er dem „Freikorps Epp“ bei, kämpfte gegen kommunistische Aufstände im Ruhrgebiet, wurde 1920 in die Reichwehr übernommen und war 1923 an der Niederschlagung des Hitlerputsches beteiligt. Nach Verwendungen bei der Truppe, als Verbindungsoffizier in Italien, an der Kriegsschule Dresden und beim Generalstab des Heers, war er 1938 beim Einmarsch in Österreich und in die Sudeten sowie 1939 beim Angriff auf Polen beteiligt (1926 Hptm., 1934 Major, 1937 Oberstlt., 1939 Oberst). Im Juni 1940 durchbrach S. mit der 6. Gebirgsdivision die Vogesenfront. Nach der Beförderung zum Generalmajor im Aug. 1940 führte er die Division 1941 nach Griechenland, durchbrach die Metaxa-Verteidigungslinie und lieb sich als Stadtkommandant Athens feiern; seine erschöpften Truppen aber bewahrte er vor einer Beteiligung an der Besetzung Kretas. Im Jan. 1942 zum Generalleutnant und schon im Juni zum General der Gebirgstruppe befördert, stabilisierte er mit dem Gebirgskorps bei schweren Verlusten für den Gegner die militärische Lage in Norwegen. Im Okt. 1943 wurde S. zur Abwehr der sowjet. Offensiven in der Ukraine eingesetzt. Seit Nov. 1943 Kommandierender General des XXXX. Panzerkorps, räumte er im Febr. 1944 gegen Hitlers Befehl unhaltbare Stellungen östlich des Dnjepr über den Brückenkopf Nikopol und rettete durch geordneten Rückzug auch ca. 1 800 Verwundete. Kurze Zeit hatte er die am 15.3.1944 übernommene Funktion als Chef des NS-Führungsstabes des Heeres beim OKH inne (Gen.oberst). Es folgten Einsätze in den gefährdetsten Bereichen der Ostfront. Als Oberbefehlshaber der Heeresgruppe Südukraine festigte S. die Front durch Truppenrücknahme nachhaltig. Seinem Drängen nach Aufgabe Sewastopols gab Hitler jedoch zu spät nach, so daß nahezu 30 000 Soldaten fielen. Seit Juli 1944 führte S. die Heeresgruppe Nord, seit Jan. 1945 die Heeresgruppe Mitte. Entgegen Hitlers Befehl räumte er oberschles. Gebiet und rettete Truppen durch Rückzug auf die Oderlinie. Am 5.4.1945 zum Generalfeldmarschall befördert, befahl er am 5.5.1945 den Truppen, sich vom Feind zu lösen und unter Mitnahme dt. Bevölkerung die amerik. Linien anzustreben. Zehn Tage später stellte er sich den Amerikanern, die ihn der Sowjetunion auslieferten. 1952 wurde S. zu 25, dann zwölfeinhalb Jahren Haft verurteilt und Anfang 1955 wegen schwerer Erkrankung (1954) nach Ostberlin entlassen. Bemühungen, ihn für die DDR zu gewinnen, blieben ungeachtet einer im Westen einsetzenden Kampagne erfolglos. Als er wenige Tage später nach München zurückkehrte, wurde eine Vielzahl von Anklagen gegen ihn erhoben, die jedoch bis auf zwei eingestellt wurden: 1957 wurde er wegen des Befehls, Fahnenflüchtige zu erschießen, zu viereinhalb Jahren Haft verurteilt, nach zwei Jahren aus gesundheitlichen Gründen jedoch entlassen.Als Soldat sah S. sich dem nationalsozialistischen Deutschland ebenso verpflichtet wie zuvor dem Kaiserreich und der Weimarer Republik. Daher hatte er keine Skrupel, zu versuchen, mit NS-Propaganda den Kampfgeist zu stärken und äußerste Einsatzbereitschaft zu verlangen. Ungeachtet divergierender Bewertungen seiner Persönlichkeit hat S. in beiden Weltkriegen herausragende militärische Leistungen bewiesen.",3501,118610279,1,1,http://www.deutsche-biographie.de/sfz115575.html
"Göttling, Johann Friedrich August",1753 bis 1809,"G. wurde bei J. Ch. Wiegleb in Langensalza zum Pharmazeuten herangebildet. Um 1775 fand er Anstellung bei dem Besitzer der Weimarer Hofapotheke, dem chemischen Unterweiser Goethes, W. H. S. Buchholz, der, selbst als wissenschaftlicher Schriftsteller bekannt, G. zu eigener wissenschaftlicher, auch literarischer Arbeit anregte. Bereits seit 1779 gab G. einen „Almanach oder Taschen-Buch für Scheidekünstler und Apotheker“ heraus, das erste Periodicum für die Pharmazie (bis 1802 von G. selbst herausgegeben). 1785-87 wurde nach Übereinkunft zwischen Buchholz, Herzog Carl August und Goethe dem – als Universitätslehrer in Jena vorgesehenen – G. das Studium in Göttingen ermöglicht. Hier trat er besonders mit G. Ch. Lichtenberg in Beziehung. Studienreisen nach England, wo er auch Priestley und dessen Laboratorium kennenlernte, und nach Holland schlossen sich an. Nach Promotion zum doctor philosophiae in Jena hielt G. seit 1789 hier als außerordentlicher Professor Vorlesungen über allgemeine Chemie, ab 1791 auch über pharmazeutische Chemie, und zwar in der philosophischen Fakultät. Durch Goethes Vermittlung war ihm schon vor seiner Amtsübernahme ein Laboratorium eingerichtet worden. Ein 1794 eröffnetes Institut zur Ausbildung von Pharmazeuten ging infolge geringer Beteiligung bald wieder ein. 1799 wurde G. zum ordentlichen Honorarprofessor und 1809 zum Ordinarius ernannt.G.s unbestreitbares wissenschaftliches Verdienst besteht darin, daß er als einer der ersten in Deutschland gegen die Phlogistonhypothese Stellung nahm und für die Verbreitung der neuen, der „französischen Chemie“ (Lavoisier) wirkte. Nicht nur als Verfasser von Unterrichtswerken – sein Lehrbuch der physikalischen Chemie gehört zu den ältesten dieser Art – machte sich G. um die Ausbildung der Chemiker verdient. Er brachte mehrere Experimentierkästen heraus. Er bereicherte auch wesentlich die analytische Chemie. Seine Arbeiten erstreckten sich über die Verbindungen des Schwefels, Arsens, Phosphors, Quecksilbers und so weiter. Verschiedene Gase erregten sein Interesse. Ferner stellte er Untersuchungen über Kampfer, Harze und verschiedene Ätherarten an. Er beschäftigte sich mit der Verbesserung chemischer Apparaturen, so veränderte er zum Beispiel den Weigelschen Destillationskühler. Auf technischchemischem Gebiete entwickelte er eigene Verfahren. G. war in Thüringen der erste, der aus Rüben Zucker zu gewinnen versuchte.|",2415,116737166,1,1,http://www.deutsche-biographie.de/sfz21492.html
