name,date,leben,lengthleben,idn,iplace,ibio,url
"Freudenthal, Berthold",1872 bis 1929,"F. studierte bis 1894 Rechtswissenschaft und Volkswirtschaft in Breslau, Tübingen und Berlin (und nochmals in Halle bei →F. von Liszt 1898/99). 1895 promovierte er in Breslau zum doctor iuris, wurde 1898 Gerichtsassessor und habilitierte sich 1899 in Breslau für Strafrecht, Völkerrecht, Staatslehre und Internationales Recht. 1901 wurde er an die Akademie für Handels- und Sozialwissenschaften in Frankfurt am Main berufen (1905 Professor, 1909-11 Rektor). Mit F. Adickes setzte er sich für die Umwandlung in eine Universität ein, wurde bei ihrer Gründung 1914 ordentlicher Professor für Strafrecht, öffentliches Recht und Rechtsvergleichung und 1914/15 Dekan der juristischen Fakultät. – F.s wissenschaftliche Arbeiten betreffen Strafrechtsdogmatik und Kriminalpolitik. Auf dogmatischem Gebiet ist vor allem seine Schrift „Schuld und Vorwurf“ (1922) zu nennen. Durch sie ist er im Anschluß an Reinhard Frank und James Goldschmidt einer der Begründer einer materiellen Schuldlehre, des sogenannten normativen Schuldbegriffs geworden. Das eigentliche Gepräge erhielt sein Wirken durch seine kriminalpolitischen Veröffentlichungen und Bemühungen. Hier stand er im Banne der soziologischen Schule Liszts, für deren Forderungen er mit großem Nachdrude auch in der Internationalen Kriminalistischen Vereinigung eintrat. Starken Einfluß hatte auf ihn auch seine Studienreise in die Vereinigten Staaten 1905 (eine weitere auch nach England 1927) ausgeübt. Er setzte sich vor allem für die unbestimmte Verurteilung, die Bekämpfung der Kriminalität Jugendlicher und die Reform des Strafvollzuges ein. Das Ziel der staatlichen Verbrechensbekämpfung soll in erster Linie die Resozialisierung des Verbrechers durch spezialpräventive Einwirkung sein, die, wenn sie erfolgreich sein solle, nicht von vornherein zeitlich begrenzt sein dürfe. Daher müsse der Strafvollzug grundlegend nach diesen Grundsätzen umgestaltet, insbesondere auf dem sogenannten Progressivsystem aufgebaut, das Jugendstrafrecht ausschließlich am Erziehungsgedanken orientiert werden. Die Errichtung des ersten deutschen Jugendgerichts in Frankfurt am Main, die 1912 erfolgte Gründung der Jugendstrafanstalt zu Wittlich/Mosel, die erstmalig in Preußen eine Sonderbehandlung Jugendlicher durchführte, die Gestaltung des Jugendgerichtsgesetzes von 1923 (die Jugendstrafe von unbestimmter Dauer ist jedoch erst wesentlich später, Verordnung von 1941, eingeführt worden) und die damaligen Reformen des Strafvollzuges überhaupt (Stufenstrafvollzug) sind weitgehend auf seinen Einfluß zurückzuführen. Dem Strafvollzug hat F. seine Aufmerksamkeit nicht nur unter kriminalpolitischen Gesichtspunkten zugewandt. Wohl als erster hat er ihn als ein Rechtsverhältnis zwischen Staat und Gefangenen gekennzeichnet und von dieser Grundlage aus dessen Rechtsstellung juristisch untersucht. – GJR.",2839,116774088,1,1,http://www.deutsche-biographie.de/sfz17097.html
"Lang, Fritz",1890 bis 1976,"L. war der ideenreichste Filmregisseur Berlins in der Zeit der Weimarer Republik. Er besuchte die Realschule und studierte an der TH Wien Architektur. Da er sich jedoch mehr für Malerei interessierte, wechselte er auf die Akademie der Graphischen Künste über und setzte seine Studien an der Staatl. Kunstgewerbeschule in München fort. Als 21jähriger wagte er den Bruch mit seiner bürgerlichen Herkunft und brachte sich während der folgenden Wanderjahre, die ihn u. a. nach Paris führten, als Maler und Karikaturist, Kabarettist und Schausteller durch. Nach Ausbruch des Weltkriegs kehrte L. in seine Heimat zurück und ging als Leutnant zur Front. Nachdem er verwundet worden war, trat er als Schauspieler im Rahmen der Truppenbetreuung auf und begann mit dem Schreiben von Film-Drehbüchern, die auf Anhieb Beachtung fanden und von der Berliner Firma Decla verfilmt wurden (von Joe May). Da L. mit der Verfilmung nicht zufrieden war, übersiedelte er 1918 nach Berlin, um sich selbst als Regisseur zu betätigen. Sein in fünf Tagen gedrehter Film „Halbblut“ (1919) machte ihn schlagartig bekannt, vollends „Der müde Tod“ (1921), ein für L.s Inszenierungsstil – Schatten, Lichtreflexe, Betonung architektonischer Strukturen – bereits kennzeichnender Film. Die Wirksamkeit der Bildersprache ist um so erstaunlicher, als man den ganzen Film noch mit einer Handkurbelkamera drehen mußte und noch keine Nachtaufnahmen machen konnte. Das Drehbuch für diesen und viele weitere Filme schrieb seine 2. Frau, Thea v. Harbou, so 1921/22 für den zweiteiligen Film „Dr. Mabuse, der Spieler“ nach dem gleichnamigen Roman von Norbert Jacques. Mit ihr zusammen schrieb L. das Drehbuch für den zweiteiligen Film „Das indische Grabmal“, dessen Regie Joe May übernahm. 1922-24 inszenierte er die beiden Teile von „Die Nibelungen“ und fuhr anschließend für zwei Monate nach Amerika. 1925/26 realisierte er – wiederum nach dem Buch seiner Frau – den sozial-utopischen Monsterfilm „Metropolis“ (mit Brigitte Helm als Schauspielerin), ein Jahr darauf „Spione“, 1929 „Frau im Mond“ und 1931 „M – Mörder unter uns“, in dem Peter Lorre den Kindermörder darstellt. Dieser Film wurde ebenso wie „Die Frau im Mond“ von den Nationalsozialisten verboten, „Die Nibelungen“ und „Metropolis“ hingegen wurden gelobt. Goebbels bot L. sogar an, eine Art Reichs-Filmintendant zu werden, aber nach dem Verbot von „Das Testament des Dr. Mabuse“ (1933) emigrierte L. nach Paris und trennte sich von Thea v. Harbou, die dem Nationalsozialismus nahestand. Seit Dez. 1933 drehte er mit Charles Boyer „Liliom“, einen Film, der für|ihn das Sprungbrett nach Hollywood wurde (1934). Hier schuf er eine Reihe bemerkenswerter Filme – 22 von insgesamt 34. Obwohl L. bemüht war, sich seinem neuen Publikum anzupassen, blieben seine Filme, in denen Romantik, Expressionismus und Neue Sachlichkeit eine faszinierende Allianz eingingen, letztlich „deutsch“. Er verfilmte die Geschichten von guten und bösen Helden, in grauer Vorzeit spielend wie im modernen Asphaltdschungel. Mit dem Bergarbeiterfilm „Fury“ (1936), den er von seinen amerikan. Arbeiten am meisten schätzte, erregte er heftige Diskussionen. Zusammen mit Brecht schrieb er das Drehbuch für einen Film über die Ermordung Heydrichs in Prag, „Hangmen also die“ (1943). L. arbeitete in verschiedenen Studios von Hollywood, vor allem bei 20th Century Fox, Paramount, Columbia und in Auftragsproduktionen für United Artists, Warner Brothers und Radio Keith Orpheum. 1945 gründete er die Gesellschaft Diana-Productions, die aber nur zwei Filme herstellte. 1956 kehrte L. nach Deutschland zurück, um an seine Erfolge in den 20er Jahren anzuknüpfen (Der Tiger von Eschnapur, 1958; Das indische Grabmal, 1958; Die 1 000 Augen des Dr. Mabuse, 1960). Diesen Filmen war jedoch kein Erfolg beschieden. Enttäuscht kehrte L. nach Amerika zurück. In den letzten Lebensjahren fast erblindet, lebte er in Beverly Hills. – „Das Wesen des Films“, sagte L. 1924, „ist nur dann überzeugend und eindringlich, wenn es sich mit dem Wesen der Zeit deckt, aus der dieser geboren wurde“. Bei der Beantwortung der Frage, was dieses Wesen der Zeit sei, verließ er sich nur auf seine eigene Intuition. Sie scheint ihn nicht getrogen zu haben: Die dichte zeitgenössische Atmosphäre von L.s Filmen bleibt beeindruckend. – Honorarprof. d. Univ. Wien (1973).
Nachlaß: Southern University of California, Los Angeles.",4386,118569244,1,1,http://www.deutsche-biographie.de/sfz47821.html
"Meumann, Ernst",1862 bis 1915,"M. erhielt zunächst Unterricht bei seinem Vater, dann erfolgte die Gymnasialbildung auf den Internatsschulen in Gütersloh und Wuppertal-Elberfeld. Nach dem Abitur begann er ein Studium der ev. Theologie an den Universitäten Halle und Bonn, beendete es jedoch mit dem Oberlehrerexamen in den Fächern Religion und Hebräisch. Ein anschließendes Medizinstudium scheiterte an der Abneigung gegen die praktische Anatomie. Schließlich wandte er sich der Philosophie zu und promovierte 1891 bei dem Logiker →Christoph Sigwart in Tübingen mit der Arbeit „Grundgesetz der Assoziation und Reproduktion von Vorstellungen“ (nicht erhalten). Sein Interesse an psychologischen Fragestellungen führte ihn im selben Jahr zu W. Wundt an das 1879 gegründete Institut für experimentelle Psychologie. Hier wurde er 1893 zweiter, 1894 erster Assistent und habilitierte sich mit der Schrift „Untersuchungen zur Psychologie und Ästhetik des Rhythmus“ (1894). 1897 wurde er als ao. Professor nach Zürich berufen (o. Prof. 1900). Über Königsberg (1905), Münster (1907), Halle (1909) und Leipzig (1910) gelangte er 1911 an das „Öffentliche Vorlesungswesen“ (Vorläufer der dann 1919 gegründeten Universität) nach Hamburg. M. sah seine Hauptaufgabe in der erfahrungswissenschaftlichen Fundierung der Pädagogik. Das messende Experiment, die kontrollierte, systematische Beobachtung und die statistischen Methoden erachtete er als die geeigneten Vorgehensweisen, um dieses Ziel verfolgen zu können. Allerdings betonte er auch wiederholt, daß in der experimentellen Pädagogik nicht die gesamte Erziehungslehre zu sehen sei. Die allgemeine, philosophische Pädagogik hat nach M. einen wesentlichen Beitrag zu leisten, z. B. bei der Bestimmung|allgemeiner Erziehungsziele. Seine wissenschaftliche Arbeit (hauptsächlich Laborexperimente) stand immer in enger Verbindung mit den Problemen der pädagogischen Praxis. An seinen jeweiligen Wirkungsstätten pflegte er intensive Kontakte zur Lehrerschaft. 1911 war er Initiator und Mitbegründer des „Bundes für Schulreform“.M. arbeitete über Zeitsinn, Gedächtnis, Intelligenz, Wille und Sprachentwicklung, aber auch Ästhetik, innerorganische Sensibilität und Fragen des sittlichen Bewußtseins von Jugendlichen. Er war (Mit-) Herausgeber und (Mit-) Begründer zahlreicher Fachorgane und ein geschickter Organisator von Kongressen. M. zählte zu den maßgeblichen Pionieren der Empirischen Pädagogik und Pädagogischen Psychologie. Die nach anfänglicher Zusammenarbeit immer stärker hervortretende Differenz mit W. A. Lay war der Entwicklung dieser noch jungen, z. T. heftigen Anfeindungen (z. B. von Ernst Weber 1905 in der Monatsschrift „Sämann“) ausgesetzten Disziplin nicht dienlich.",2688,119027577,1,1,http://www.deutsche-biographie.de/sfz62478.html
"Reichenau, Walter von",1884 bis 1942,"R. trat 1903 nach dem Abitur in das 1. Garde-Feldartillerie-Rgt. ein, besuchte 1908 mit seinem Vater Südamerika, 1913 mit dem Dt. Olympischen Komitee die USA und diente im 1. Weltkrieg als Front- und Generalstabsoffizier. In die Reichswehr übernommen, arbeitete er 1932 als Chef des Stabes des ostpreuß. Wehrkreises I unter Generalleutnant Werner v. Blomberg, der ihn 1933 als Chef des Ministeramtes im Reichswehrministerium auf eine einflußreiche Schaltstelle zwischen Politik und Militär berief (Chef d. Wehrmachtamts). 1932 hatte R. durch die Vermittlung seines Onkels Hitler persönlich kennengelernt. An der Ermordung der SA-Führung am 30.6./1.7.1934 („Röhm-Putsch“) war er organisatorisch beteiligt. Neben seinen professionellen Fähigkeiten beim Aufbau der Reichswehr dürfte die stete Hervorhebung seiner NS-Gesinnung bewirkt haben, daß Hitler ihn 1934 und 1938 als neuen Oberbefehlshaber des Heeres ins Auge faßte. Hindenburg und Papen bzw. Rundstedt verhinderten jedoch die erhoffte Beförderung. R.s Pläne zum Aufbau eines Wehrmachtgeneralstabs scheiterten an den Vorbehalten der Teilstreitkräfte, so daß er sich über entsprechende Truppenkommandos zu qualifizieren suchte (1935 Kommandeur d. 7. Armee in München, 1938 d. 4. Armee in Leipzig). Im Krieg gegen Polen führte R. erfolgreich die 10. Armee, wurde am 30.9.1939 zum Generaloberst befördert und mit dem Ritterkreuz ausgezeichnet. Trotz seiner Nähe zum Nationalsozialismus protestierte er gegen Greueltaten der SS an der poln. Zivilbevölkerung. Wie andere Generäle wandte er sich gegen Hitlers Befehl zum Angriff auf Frankreich und nahm sogar konspirative Kontakte zu den Niederlanden auf. Im Frühjahr 1940 konzentrierte er sich wieder auf seine militärischen Aufgaben als Befehlshaber der 6. Armee. Am 19.7.1940 wurde der 56jährige R. zum jüngsten dt. Feldmarschall ernannt, obgleich intern auch Kritik an seiner Operationsführung in Belgien geäußert worden war.Im Krieg gegen Rußland trat R. weniger durch die Erfolge seiner am Südabschnitt eingesetzten Armee als vielmehr durch seine schillernde Persönlichkeit hervor. Er selbst führte mehrere Sturmangriffe seiner Truppen in vorderster Linie an, widersetzte sich oftmals den Befehlen seiner Vorgesetzten und ging brutal gegen die Zivilbevölkerung vor. Am 10.10.1941 erließ R. den berüchtigten Armeebefehl, in dem er u. a. zur „Sühne am jüd. Untermenschentum“ aufrief. In der neueren Forschung wird hierin v. a. ein Versuch des operativ nur durchschnittlich begabten R. gesehen, sich bei Hitler ideologisch hervorzutun. Dieser lehnte ihn nach der Entlassung Walther v. Brauchitschs im Dez. 1941 als neuen Oberbefehlshaber des Heeres ab, weil er „zu politisch“ sei und übernahm selber diesen Posten. R. erhielt am 3.12.1941 das Kommando über die Heeresgruppe Süd. Nur wenige Wochen später erlitt er einen Schlaganfall und verstarb auf dem Rücktransport nach Deutschland.",2886,123390699,1,1,http://www.deutsche-biographie.de/sfz104884.html
"Hoff, Hans",1897 bis 1969,"H. schloß das Medizinstudium in Wien nach Militärdienst 1922 ab und trat in die psychiatrisch-neurologische Klinik unter J. Wagner-Jauregg ein. Dessen Nachfolger E. Pötzl bestellte ihn 1928 zum Assistenten, 1932 erreichte er die Venia legendi, 1936 wurde er Vorstand der Neurologischen Abteilung der Wiener Poliklinik. 1938 folgte er einer Berufung als Professor für Neurologie und Psychiatrie an die Royal Medical School in Bagdad, 1942 wurde er Assistant Professor im Neurologischen Institut und später im Presbyterian Hospital der Columbia University in New York. 1949 kehrte H. nach Wien zurück und übernahm den Lehrstuhl für Neurologie im Neurologischen Institut und gleichzeitig ein Primariat in der Neurologischen Heilanstalt Rosenhügel. 1950 wurde er zum|Vorstand der Psychiatrisch-Neurologischen Universitätsklinik ernannt.Vor 1938 beschäftigten H. vorwiegend neurologische Themen. Er bemühte sich um den Ausbau der Hirntumordiagnostik, arbeitete über Metalues und progressive Paralyse, über die Encephalitiden, über die Störungen der höheren Hirnleistungen (Aphasie, Agnosie, Apraxie). Themen über Epilepsie und multiple Sklerose leiteten über zu psychiatrischen und soziatrischen Fragestellungen. Bevorzugt beschäftigte er sich mit Fragen der Pharmakopsychiatrie, der Psychohygiene, der forensischen Psychiatrie, der psychiatrischen Rehabilitation und der Organisation des modernen psychiatrischen Krankenhauses. Er füllte seine Klinik mit neuem Geist und richtete Sonderstationen für Kinderpsychiatrie, für psychosomatische Störungen, für multiple Sklerose, für Rehabilitation von Schädel- und Hirnverletzten, zahlreiche Spezialambulanzen und Forschungslaboratorien ein. Arbeitstherapie wurde bei allen Formen von geistigen und neurologischen Störungen gepflegt. Auf H.s Initiative ging die Gründung des Genesungsheimes Kalksburg für Alkoholkranke und des Rehabilitationszentrums Lanzendorf für Schizophrene zurück. Er bemühte sich um die Resozialisierung jugendlicher Krimineller in der Bundeserziehungsanstalt Kaiser-Ebersdorf. Seine Bestrebungen um einen menschlichen Strafvollzug bei geisteskranken Kriminellen führten zur Gründung der Sonderanstalt Mittersteig.H. war als wissenschaftlicher Schriftsteller ungemein produktiv.|",2243,118705806,1,1,http://www.deutsche-biographie.de/sfz33014.html
"Putz, Leo",1869 bis 1940,"Ersten Zeichenunterricht erhielt P. seit 1886 in München bei seinem Stiefbruder, seit 1888 war er Schüler von →Gabriel v. Hackl (1843–1926) an der Akademie der Bildenden Künste in München. 1889 und 1896 hielt er sich in Dachau bei →Adolf Hölzel (1853–1934) und dessen „Neu-Dachauer Kreis“ auf, dessen Einfluß bestimmend für P.s Freiluftmalerei wurde. 1891 studierte er an der Pariser Académie Julian bei Bouguereau und Constant und arbeitete nach seiner Rückkehr noch ein Jahr bei →Paul Höcker (1854–1910) in München. Seit 1895 lebte P. als freier Maler in München und stellte erstmals mit Erfolg in der „Sezession“ aus, wo er im folgenden Jahr mit seinem großen Gemälde „Vanitas“ Aufsehen erregte. In seinen zahlreichen zeichnerischen Arbeiten für die Zeitschrift „Jugend“ griff er Anregungen aus Rokoko und Biedermeier sowie Märchenmotive auf und nutzte sein Talent für Karikaturen. 1899 wurde P. eines der Gründungsmitglieder der Künstlervereinigung „Die Scholle“, die fast alle dem Schülerkreis Höckers entstammten und maltechnisch stark von Wilhelm Trübner geprägt waren. P.s Werke aus dieser Phase strebten, wie die der übrigen „Scholle“-Mitglieder, in ihrer unkonventionellen Sehweise nicht nach realistischer Abbildung ihrer Motive, sondern ordneten räumliche Strukturen und Einsatz der Farbe der Betonung der Fläche unter. Die symbolistische Seite des Jugendstils, von Stuck beeinflußt, zeigen P.s anthropomorphe Schneckenbilder, die ihn in der Behandlung von Farben und Oberflächen als exzellenten Koloristen ausweisen. Kurz nach 1900 löste er sich vom Jugendstil und gelangte zwischen 1902 und 1914 mit neoimpressionistischen Freilichtbildern, die v. a. in Hartmannsberg am Chiemsee entstanden, zu seinem Reifestil: In zahlreichen Kahn- und Aktbildern sowie Darstellungen von badenden Frauen spielte er seine koloristische Sensibilität und Delikatesse in der Behandlung des Lichts vollendet aus (Picknick, 1904, München, Neue Pinakothek).Eine Sonderstellung aufgrund der psychologisch-realistischen Behandlung des Themas nimmt der zu Lebzeiten nicht veröffentlichte graphische Zyklus „Ein Mord“ ein (1918-21, Privatbes.). 1928 reiste P. mit seiner Familie nach Brasilien, wo er unter dem Einfluß des tropischen Lichts erneut seinen Stil änderte. Nachdem er die anfänglich dort geschaffenen Bilder nahezu alle vernichtet hatte, fand er zu einem gemäßigten Expressionismus unter dem Einfluß von Gauguin und den Brücke-Malern. 1930 folgte eine Reise nach Argentinien, 1931 übernahm P. eine ao. Professur an der Escola Nacional de Bellas Artes in Rio de Janeiro. Im Januar 1933 kehrte er nach Europa zurück, wo er noch in München und Stuttgart ausstellen konnte, ehe er 1937 aus der Reichskulturkammer ausgeschlossen wurde. P zog sich nach Meran zurück, wo er bis zu seinem Tod Landschafts- und Blumenmotive malte und zeichnete.|",2836,118597205,1,1,http://www.deutsche-biographie.de/sfz103917.html
"Naumann, Hans",1886 bis 1951,"Nach dem Abitur am Gymnasium in Zittau 1907 studierte N. Germanistik in München, Kiel, Berlin und Straßburg, wo er 1911 mit der Dissertation „Altnordische Namensstudien“ (1912) bei →Rudolf Henning promovierte und sich 1913 aufgrund der Schrift „Notkers Boethius, Untersuchungen über Quellen und Stil“ habilitierte. 1914 veröffentlichte er eine „Althochdeutsche Grammatik“, in der er auch eine gemeinwestgermanische Sprache zu erschließen suchte. 1915 – acht Jahre vor dem grundlegenden Werk Otto Behaghels – eine „Kurze historische Syntax der deutschen Sprache“. Während seines Kriegsdienstes als Unteroffizier im Osten redigierte er seit 1916 „Die Kriegswoche“, danach die Zeitung der 10. Armee „Die Wacht im Osten“. Seit 1918 Professor in Straßburg, wurde er nach der Rückgabe Elsaß-Lothringens 1919 alsao. Professor nach Jena berufen. 1920 widmete er dem gefallenen Kollegen und Dichter Ernst Stadler eine Gedenkschrift und trat in freundschaftliche Beziehung zu Eugen Diederichs, in dessen Verlag 1921 seine Aufsatzsammlung „Primitive Gemeinschaftskultur“ erschien. Hier wie in den „Grundzügen der deutschen Volkskunde“ (1922) exemplifizierte N. an zahlreichen Beispielen den im Anschluß an den franz. Ethnologen Levy-Brühl gefaßten, umstrittenen Gedanken des gesunkenen Kulturguts: Der durch eine Oberschicht veranlaßte kulturelle Fortschritt wird demnach von einer Unterschicht jeweils nur rezipiert und umstilisiert. Sein wohl durch Diederichs angeregtes Interesse für die neueste deutsche Literatur zeigt N.s vielbeachteter Band „Die deutsche Dichtung der Gegenwart 1885-1923“ (1923, erweitert um das Kapitel|„Versuch über die Neue Sachlichkeit“ 41930, zuletzt 61933). 1921 wurde N. als Nachfolger Friedrich Panzers o. Professor in Frankfurt, seit 1932 wirkte er als Nachfolger Rudolf Meißners in Bonn. Im Wintersemester 1934 Rektor, wurde er im Frühjahr 1935 abgesetzt, weil er im Fall der Suspendierung und Entlassung von Karl Barth nicht ganz den Vorstellungen der Regierung entsprechend verfahren war. Während seiner Lehrtätigkeit veröffentlichte er zahlreiche Schriften vor allem zur deutschen Volkskunde und zur german. Mythologie, zur Geschichte der deutschen Sprache sowie zur deutschen Literatur des Mittelalters, die ihn, auch wo sie „nicht… wesentlich neue Resultate“ (Spamer) boten, als „großen Anreger“ (Betz) dieser Fachrichtungen zu Geltung und hohem Ansehen brachten. Gerade dieses war auch Grundlage für N.s außerordentliche Wirksamkeit als ein aus eigenem Antrieb handelnder, wissenschaftlicher Parteigänger des Nationalsozialismus seit 1933. So veröffentlichte er bereits 1932 in Parallelität zu E. R. Curtius' „Deutscher Geist in Gefahr“ seine Schrift „Deutsche Nation in Gefahr“, in der er die Aufklärung verurteilte und in „Führer und Gefolgschaftsgedanken“ die Rettung der Nation sah. Wie Ernst Bertram und Gerhard Fricke rechtfertigte er denn auch die Bücherverbrennung im Mai 1933 als „Kampf wider den undeutschen Geist“ in einer Rede vor der Bonner Studentenschaft. Ähnlich öffentlichkeitswirksame Auftritte hatte er mit seiner Rektoratsrede „Der Hohe Mut und das Freie Gemüte“ (1934) sowie mit Reden zu Geburtstagen des „Führers“ 1937 und 1939. Gestützt auf das Vertrauen der Studenten in den Kenntnisreichtum des Altgermanisten, stellte er dabei jeweils die Wiederkunft altgermanischer Tugenden in der Person Hitlers dar. Über die Aberkennung von Thomas Manns Ehrendoktor im Dezember 1936, betrieben durch den damaligen Dekan, den Germanisten K. J. Obenauer, äußerte sich N. gegenüber einer dän. Zeitung geringfügig abweichend: er hielt sie für „nicht notwendig“. Nach 1945 veranlaßte die Besatzungsmacht den Entzug seiner Lehrbefugnis. In einem von N. angestrengten Verwaltungsgerichtsverfahren wurde im Juli 1952 sein Anspruch auf eine Stelle als o. Professor seit Sept. 1949 festgestellt.",3827,119108291,1,1,http://www.deutsche-biographie.de/sfz69210.html
